,arg1,arg2,verb,sentence,verb_idx,label,new_sentences,new_ind
275,pilot,,kite, The pilot kited for a long time over the mountains .,2,0,pilot has propertyfly pilot is at locationin plane pilot is used forfly kite desires fly. kite is at location sky. kite is used for fun.  The pilot kited for a long time over the mountains .,38
276,bird,,land, The bird landed on the highest branch .,2,0,bird has propertyvery smart bird is at locationin sky bird is used forfly land desires water. land is at location earth. land is used for grow food.  The bird landed on the highest branch .,37
277,airplane,,land, the pilot managed to land the airplane safely .,4,0,airplane has propertynoisy airplane is at locationairport airplane is used fortravel land desires water. land is at location earth. land is used for grow food.  the pilot managed to land the airplane safely .,38
278,jail,,land, this may land you in jail .,2,1,jail has propertybad jail is at locationjail jail is used forpunishment land desires water. land is at location earth. land is used for grow food.  this may land you in jail .,34
279,smuggler,,land, The drug smugglers landed the heroin on the beach of the island .,3,0,smuggler has propertyillegal activity smuggler is at locationport smuggler is used forcriminal land desires water. land is at location earth. land is used for grow food.  The drug smugglers landed the heroin on the beach of the island .,42
280,blow,,land, He landed several blows on his opponent 's head .,1,1,blow has propertyfun blow is at locationwall blow is used forhit someone land desires water. land is at location earth. land is used for grow food.  He landed several blows on his opponent 's head .,37
281,ship,,land, The ship landed in Pearl Harbor .,2,0,ship has propertynoisy ship is at locationocean ship is used fortravel land desires water. land is at location earth. land is used for grow food.  The ship landed in Pearl Harbor .,34
282,book,,lay, lay the books on the table .,0,0,book has propertyheavy book is at locationlibrary book is used forlearn lay desires play. lay is at location in bed. lay is used for sleep.  lay the books on the table .,32
283,foundation,,lay, lay the foundation for a new health care plan .,0,1,foundation has propertyhard foundation is at locationbuild foundation is used forbuild wall lay desires play. lay is at location in bed. lay is used for sleep.  lay the foundation for a new health care plan .,36
284,responsibility,,lay, lay a responsibility on someone .,0,1,responsibility has propertyimportant responsibility is at locationschool responsibility is used formake decision lay desires play. lay is at location in bed. lay is used for sleep.  lay a responsibility on someone .,32
285,news,,leak, The news were leaked to the paper .,3,1,news has propertybad news is at locationtelevision news is used forgossip leak desires leak. leak is at location faucet. leak is used for make water transparent.  The news were leaked to the paper .,37
286,water,,leak, Water leaked out of the can into the backpack .,1,0,water has propertynecessary for life water is at locationice cube water is used forwash leak desires leak. leak is at location faucet. leak is used for make water transparent.  Water leaked out of the can into the backpack .,40
287,container,,leak, The container leaked gasoline .,2,0,container has propertyheavy container is at locationkitchen container is used forhold thing leak desires leak. leak is at location faucet. leak is used for make water transparent.  The container leaked gasoline .,34
288,rifle,,lean, He leaned his rifle against the wall .,1,0,rifle has propertydangerous rifle is at locationarmory rifle is used forkill person lean desires be with woman. lean is at location kitchen. lean is used for support.  He leaned his rifle against the wall .,36
289,car,,lend, I will lend you my car .,2,0,car has propertydangerous car is at locationin garage car is used fortravel lend desires get money. lend is at location bank. lend is used for buy thing.  I will lend you my car .,36
290,story,,lend, This story would lend itself well to serialization on television .,3,1,story has propertyinaccurate story is at locationnewspaper story is used forentertainment lend desires get money. lend is at location bank. lend is used for buy thing.  This story would lend itself well to serialization on television .,40
291,criticism,,level, level criticism or charges at somebody .,0,1,criticism has propertybad criticism is at locationschool criticism is used formake person angry level desires win. level is at location desk. level is used for measure weight.  level criticism or charges at somebody .,34
292,building,,level, The building was levelled .,3,0,building has propertytall building is at locationbuild building is used forshelter level desires win. level is at location desk. level is used for measure weight.  The building was levelled .,33
293,ground,,level, The ground levelled off .,2,0,ground has propertyflat ground is at locationgrind ground is used forstand on level desires win. level is at location desk. level is used for measure weight.  The ground levelled off .,33
294,fate,,lie, The fate of Bosnia lies in the hands of the West .,4,1,fate has propertyinevitable fate is at locationuniverse fate is used forend life lie desires win. lie is at location tabloid newspaper. lie is used for deception.  The fate of Bosnia lies in the hands of the West .,42
295,conversation,,lighten, the conversation lightened me up a bit .,2,1,conversation has propertyimportant to person conversation is at locationdinner conversation is used forcommunicate lighten desires light. lighten is at location boat. lighten is used for lighten mood.  the conversation lightened me up a bit .,37
296,load,,lighten, she lightened the load on the tired donkey .,1,0,load has propertyheavy load is at locationgarage load is used forcarry lighten desires light. lighten is at location boat. lighten is used for lighten mood.  she lightened the load on the tired donkey .,35
297,room,,lighten, The room lightened up .,2,0,room has propertydark room is at locationhouse room is used forsleep lighten desires light. lighten is at location boat. lighten is used for lighten mood.  The room lightened up .,32
298,tree,,line, trees line the riverbank .,1,1,tree has propertygreen tree is at locationforest tree is used forshade line desires win. line is at location subway. line is used for measure.  trees line the riverbank .,30
299,sorrow,,line, sorrow had lined his face .,2,1,sorrow has propertybad sorrow is at locationfuneral sorrow is used formourn line desires win. line is at location subway. line is used for measure.  sorrow had lined his face .,32
300,book,,line, lined books are more enduring .,0,0,book has propertyheavy book is at locationlibrary book is used forlearn line desires win. line is at location subway. line is used for measure.  lined books are more enduring .,30
301,truck,,load, load the truck with hay .,0,0,truck has propertynoisy truck is at locationgarage truck is used fortransport thing load desires travel. load is at location garage. load is used for carry.  load the truck with hay .,31
302,gun,,load, He loaded his gun carefully .,1,0,gun has propertydangerous gun is at locationpolice station gun is used forkill person load desires travel. load is at location garage. load is used for carry.  He loaded his gun carefully .,33
303,bag,,load, load the bags onto the trucks .,0,0,bag has propertyheavy bag is at locationgrocery store bag is used forcarry thing load desires travel. load is at location garage. load is used for carry.  load the bags onto the trucks .,33
304,bike,,lock, Lock the bike to the fence !,0,0,bike has propertyfun bike is at locationgarage bike is used fortravel lock desires open. lock is at location garage. lock is used for keep person out.  Lock the bike to the fence !,33
305,knee,,lock, The therapist noticed that the patient 's knees tended to lock in this exercise .,10,0,knee has propertybend knee is at locationtable knee is used forstand lock desires open. lock is at location garage. lock is used for keep person out.  The therapist noticed that the patient 's knees tended to lock in this exercise .,51
306,hand,,lock, He locked his hands around her neck .,1,1,hand has propertyhold up by wrist hand is at locationpurse hand is used forhold thing lock desires open. lock is at location garage. lock is used for keep person out.  He locked his hands around her neck .,39
307,laughing,,lock, He was locked in a laughing fit .,2,1,laughing has propertygood laughing is at locationcircus laughing is used forfun lock desires open. lock is at location garage. lock is used for keep person out.  He was locked in a laughing fit .,36
308,jewel,,lock, She locked her jewels in the safe .,1,0,jewel has propertyexpensive jewel is at locationjewelry store jewel is used forplay lock desires open. lock is at location garage. lock is used for keep person out.  She locked her jewels in the safe .,36
309,bicycle,,loop, The bicycle looped around the tree .,2,1,bicycle has propertyfun bicycle is at locationstreet corner bicycle is used fortravel loop desires play game. loop is at location bicycle. loop is used for hold thing together.  The bicycle looped around the tree .,37
310,plane,,loop, The stunt pilot looped his plane .,3,0,plane has propertyfly plane is at locationairport plane is used forfly loop desires play game. loop is at location bicycle. loop is used for hold thing together.  The stunt pilot looped his plane .,37
311,surface,,map, map the surface of Venus .,0,0,surface has propertyflat surface is at locationocean surface is used forhold thing together map desires map. map is at location library. map is used for find place.  map the surface of Venus .,33
312,galaxy,,map, We have n't even begun to map the many galaxies that we know exist .,6,0,galaxy has propertylarge galaxy is at locationspace galaxy is used forlive in map desires map. map is at location library. map is used for find place.  We have n't even begun to map the many galaxies that we know exist .,47
313,sorrow,,map, sorrow was mapped on the mother 's face .,2,1,sorrow has propertybad sorrow is at locationfuneral sorrow is used formourn map desires map. map is at location library. map is used for find place.  sorrow was mapped on the mother 's face .,36
314,prisoner,,march, The Japanese marched their prisoners through Manchuria .,2,0,prisoner has propertydangerous prisoner is at locationprison prisoner is used forpunishment march desires fight war. march is at location march hare. march is used for march.  The Japanese marched their prisoners through Manchuria .,36
315,contribution,,match, The company matched the employees ' contributions .,2,1,contribution has propertyimportant contribution is at locationmeet contribution is used formake decision match desires light. match is at location match. match is used for light candle.  The company matched the employees ' contributions .,36
316,dream,,match, This job does n't match my dreams .,4,1,dream has propertyfun dream is at locationyour mind dream is used forfun match desires light. match is at location match. match is used for light candle.  This job does n't match my dreams .,38
317,athlete,,match, Let them match their best athletes against ours .,2,1,athlete has propertyvery competitive athlete is at locationsoccer game athlete is used forplay sport match desires light. match is at location match. match is used for light candle.  Let them match their best athletes against ours .,39
318,piece,,match, The two pieces match .,3,0,piece has propertyflat piece is at locationpuzzle piece is used formake music match desires light. match is at location match. match is used for light candle.  The two pieces match .,34
319,experience,,mellow, Age and experience mellowed him over the years .,3,1,experience has propertyimportant experience is at locationschool experience is used forlearn mellow desires soothe. mellow is at location refrigerator. mellow is used for relax.  Age and experience mellowed him over the years .,36
320,apple,,mellow, These apples need to mellow a bit more .,4,0,apple has propertygreen apple is at locationfridge apple is used foreat mellow desires soothe. mellow is at location refrigerator. mellow is used for relax.  These apples need to mellow a bit more .,37
321,wax,,melt, The wax melted in the sun .,2,0,wax has propertysticky wax is at locationjar wax is used forclean melt desires eat. melt is at location ice. melt is used for make ice.  The wax melted in the sun .,34
322,ice,,melt, The sun melted the ice .,2,0,ice has propertycold ice is at locationfreezer ice is used forcool thing melt desires eat. melt is at location ice. melt is used for make ice.  The sun melted the ice .,34
323,actor,,melt, Hundreds of actors were melting into the scene .,4,1,actor has propertygood at act actor is at locationmovie actor is used forplay melt desires eat. melt is at location ice. melt is used for make ice.  Hundreds of actors were melting into the scene .,40
324,resistance,,melt, her resistance melted under his charm .,2,1,resistance has propertybad resistance is at locationwar resistance is used forcontrol melt desires eat. melt is at location ice. melt is used for make ice.  her resistance melted under his charm .,34
325,furniture,,mold, The furniture molded in the old house .,2,0,furniture has propertydecorative furniture is at locationhouse furniture is used formake room comfortable mold desires water. mold is at location refrigerator. mold is used for make something.  The furniture molded in the old house .,37
326,ball,,mold, She molded the rice balls carefully .,1,0,ball has propertyround ball is at locationtoy store ball is used forplay basketball mold desires water. mold is at location refrigerator. mold is used for make something.  She molded the rice balls carefully .,35
327,dress,,mold, The dress molds her beautiful figure .,2,1,dress has propertysexy dress is at locationsuitcase dress is used fordress mold desires water. mold is at location refrigerator. mold is used for make something.  The dress molds her beautiful figure .,34
328,aerator,,mount, They mounted the aerator on a floating .,1,0,aerator has propertyfast aerator is at locationair aerator is used forlift mount desires ride horse. mount is at location mountain. mount is used for ride horse.  They mounted the aerator on a floating .,35
329,slide,,mount, mount slides for macroscopic analysis .,0,0,slide has propertyhard slide is at locationpiano slide is used forslide mount desires ride horse. mount is at location mountain. mount is used for ride horse.  mount slides for macroscopic analysis .,32
330,campaign,,mount, mount a campaign against pornography .,0,1,campaign has propertybad campaign is at locationcity campaign is used forget money mount desires ride horse. mount is at location mountain. mount is used for ride horse.  mount a campaign against pornography .,33
331,production,,mount, mount a theater production .,0,1,production has propertyfun production is at locationtheater production is used forproduce mount desires ride horse. mount is at location mountain. mount is used for ride horse.  mount a theater production .,31
332,husband,,nag, She nags her husband all day long .,1,0,husband has propertymale husband is at locationbed husband is used forwife nag desires be let out. nag is at location your dog. nag is used for get food.  She nags her husband all day long .,37
333,doubt,,nag, nagging concerns and doubts .,0,1,doubt has propertyfalse doubt is at locationbible doubt is used forlie nag desires be let out. nag is at location your dog. nag is used for get food.  nagging concerns and doubts .,33
334,security,,negociate, negociate securities .,0,0,security has propertybad security is at locationairport security is used forprotect person negociate desires equality. negociate is at location india. negociate is used for live in.  negociate securities .,29
335,mountain,,negociate, The hiker negociated the high mountain pass .,2,1,mountain has propertyvery tall mountain is at locationmountain mountain is used forclimb negociate desires equality. negociate is at location india. negociate is used for live in.  The hiker negociated the high mountain pass .,36
336,party,,negociate, The parties negociated all night .,2,0,party has propertyfun party is at locationfraternity house party is used forcelebrate negociate desires equality. negociate is at location india. negociate is used for live in.  The parties negociated all night .,34
337,republic,,neutralize, The treaty neutralized the small republic .,2,1,republic has propertycorrupt republic is at locationchina republic is used forgovern neutralize desires win. neutralize is at location war. neutralize is used for kill.  The treaty neutralized the small republic .,33
338,optimism,,neutralize, Her optimism neutralizes his gloom .,2,1,optimism has propertygood optimism is at locationoffice build optimism is used foroptimism neutralize desires win. neutralize is at location war. neutralize is used for kill.  Her optimism neutralizes his gloom .,33
339,solution,,neutralize, She neutralized the solution .,1,0,solution has propertyimportant solution is at locationmath book solution is used forsolve problem neutralize desires win. neutralize is at location war. neutralize is used for kill.  She neutralized the solution .,32
340,approval,,nod, He nodded his approval .,1,0,approval has propertyimportant approval is at locationchurch approval is used formake decision nod desires be understand. nod is at location restaurant. nod is used for indicate agreement.  He nodded his approval .,33
341,teacher,,nod, The teacher nodded when the student gave the right answer .,2,0,teacher has propertyimportant teacher is at locationclassroom teacher is used forteach nod desires be understand. nod is at location restaurant. nod is used for indicate agreement.  The teacher nodded when the student gave the right answer .,39
342,man,,nod, The old man was nodding in his chair .,4,0,man has propertymale man is at locationoffice man is used forlove nod desires be understand. nod is at location restaurant. nod is used for indicate agreement.  The old man was nodding in his chair .,39
343,flower,,nod, the flowers were nodding in the breeze .,3,1,flower has propertypretty flower is at locationwindowsill flower is used fordecorate room nod desires be understand. nod is at location restaurant. nod is used for indicate agreement.  the flowers were nodding in the breeze .,38
344,room,,paint, We painted the rooms yellow .,1,0,room has propertydark room is at locationhouse room is used forsleep paint desires paint picture. paint is at location art show. paint is used for make art.  We painted the rooms yellow .,34
345,mistress,,paint, He painted his mistress many times .,1,0,mistress has propertygood at what she do mistress is at locationmansion mistress is used forsex paint desires paint picture. paint is at location art show. paint is used for make art.  He painted his mistress many times .,39
346,heart,,palpitate, Her violent feelings palpitated the young woman 's heart .,3,0,heart has propertystrong heart is at locationperson heart is used forlove palpitate desires vomit. palpitate is at location stomach. palpitate is used for increase heart rate.  Her violent feelings palpitated the young woman 's heart .,39
347,sign,,paste, paste the sign on the wall .,0,0,sign has propertyred sign is at locationroadblock sign is used fortell you something paste desires paste. paste is at location fridge. paste is used for make paste.  paste the sign on the wall .,34
348,wall,,paste, paste the sign on the wall .,0,0,wall has propertyvertical wall is at locationwall wall is used fordivide room paste desires paste. paste is at location fridge. paste is used for make paste.  paste the sign on the wall .,33
349,opponent,,paste, He pasted his opponent .,1,1,opponent has propertycompetitive opponent is at locationsport event opponent is used forwin paste desires paste. paste is at location fridge. paste is used for make paste.  He pasted his opponent .,32
350,moon,,peep, The new moon peeped through the tree tops .,3,1,moon has propertyround moon is at locationsky moon is used forenergy peep desires fly. peep is at location church. peep is used for let in light.  The new moon peeped through the tree tops .,38
351,cold,,pierce, The cold pierced her bones .,2,1,cold has propertyhard to ski on cold is at locationfreezer cold is used forkill bacteria pierce desires get lay. pierce is at location your finger. pierce is used for kill animal.  The cold pierced her bones .,39
352,scream,,pierce, The scream pierced the night .,2,1,scream has propertybad scream is at locationopera scream is used forget help pierce desires get lay. pierce is at location your finger. pierce is used for kill animal.  The scream pierced the night .,36
353,needle,,pierce, The needle pierced her flesh .,2,0,needle has propertysharp needle is at locationsew kit needle is used forinject blood pierce desires get lay. pierce is at location your finger. pierce is used for kill animal.  The needle pierced her flesh .,37
354,needle,,pin, pin the needle to the shirt .,0,0,needle has propertysharp needle is at locationsew kit needle is used forinject blood pin desires play game. pin is at location desk. pin is used for hold thing together.  pin the needle to the shirt .,36
355,bug,,ping, The bugs pinged the lamp shade .,2,0,bug has propertysmall bug is at locationtree bug is used foreat ping desires play game. ping is at location toy store. ping is used for play ping pong.  The bugs pinged the lamp shade .,37
356,bullet,,ping, the bullet pinged when they struck the car .,2,0,bullet has propertydangerous bullet is at locationgun bullet is used forkill ping desires play game. ping is at location toy store. ping is used for play ping pong.  the bullet pinged when they struck the car .,39
357,accountant,,ping, I 'll ping my accountant -- April 15 is nearing .,2,1,accountant has propertyvery important accountant is at locationoffice accountant is used formanage company ping desires play game. ping is at location toy store. ping is used for play ping pong.  I 'll ping my accountant -- April 15 is nearing .,43
358,machine,,ping, ping your machine in the office .,0,0,machine has propertymechanical machine is at locationlaboratory machine is used formake popcorn ping desires play game. ping is at location toy store. ping is used for play ping pong.  ping your machine in the office .,36
359,market,,plunge, the stock market plunged .,3,1,market has propertyvery popular market is at locationcity market is used forbuy thing plunge desires swim. plunge is at location river. plunge is used for kill yourself.  the stock market plunged .,35
360,student,,plunge, The professor plunged his students into the study of the Italian text .,2,1,student has propertysmart student is at locationclassroom student is used forlearn plunge desires swim. plunge is at location river. plunge is used for kill yourself.  The professor plunged his students into the study of the Italian text .,40
361,mind,,poison, poison someone 's mind .,0,1,mind has propertygood mind is at locationyour head mind is used forthink poison desires kill. poison is at location laboratory. poison is used for kill.  poison someone 's mind .,30
362,husband,,poison, She poisoned her husband .,1,0,husband has propertymale husband is at locationbed husband is used forwife poison desires kill. poison is at location laboratory. poison is used for kill.  She poisoned her husband .,30
363,drink,,poison, Her husband poisoned her drink in order to kill her .,2,0,drink has propertygood drink is at locationbar drink is used forquench your thirst poison desires kill. poison is at location laboratory. poison is used for kill.  Her husband poisoned her drink in order to kill her .,39
364,mushroom,,poison, This mushrooms can poison .,3,0,mushroom has propertygreen mushroom is at locationforest mushroom is used foreat poison desires kill. poison is at location laboratory. poison is used for kill.  This mushrooms can poison .,32
365,book,,portray, The book portrays the actor as a selfish person .,2,1,book has propertyheavy book is at locationlibrary book is used forlearn portray desires person to believe. portray is at location movie. portray is used for portray character.  The book portrays the actor as a selfish person .,39
366,father,,portray, The father is portrayed as a good - looking man in this painting .,3,0,father has propertymale father is at locationfamily father is used forteach portray desires person to believe. portray is at location movie. portray is used for portray character.  The father is portrayed as a good - looking man in this painting .,44
367,question,,pose, This poses an interesting question .,1,1,question has propertyimportant question is at locationnewspaper question is used forfind truth pose desires be good at something. pose is at location theatre. pose is used for show off.  This poses an interesting question .,36
368,woman,,pose, We do n't know the woman who posed for Leonardo so often .,7,0,woman has propertywalk along beach woman is at locationbed woman is used forhave sex pose desires be good at something. pose is at location theatre. pose is used for show off.  We do n't know the woman who posed for Leonardo so often .,51
369,knocker,,pound, the salesman pounded the door knocker .,2,0,knocker has propertyopen knocker is at locationfront door knocker is used forget someone attention pound desires win. pound is at location jar. pound is used for weigh item.  the salesman pounded the door knocker .,37
