,arg1,arg2,verb,sentence,verb_idx,label,new_sentences,new_ind
370,water,,pound, The locks pound the water of the canal .,2,1,water has propertynecessary for life water is at locationice cube water is used forwash pound desires win. pound is at location jar. pound is used for weigh item.  The locks pound the water of the canal .,39
371,prisoner,,pound, The prisoners are safely pounded .,4,1,prisoner has propertydangerous prisoner is at locationprison prisoner is used forpunishment pound desires win. pound is at location jar. pound is used for weigh item.  The prisoners are safely pounded .,35
372,water,,pour, They poured water over the floor .,1,0,water has propertynecessary for life water is at locationice cube water is used forwash pour desires light. pour is at location kitchen. pour is used for quench your thirst.  They poured water over the floor .,37
373,water,,pour, They poured water over the floor .,1,0,water has propertynecessary for life water is at locationice cube water is used forwash pour desires light. pour is at location kitchen. pour is used for quench your thirst.  They poured water over the floor .,37
374,people,,pour, People were pouring out of the theater .,2,1,people has propertyselfish people is at locationbus stop people is used forwork pour desires light. pour is at location kitchen. pour is used for quench your thirst.  People were pouring out of the theater .,37
375,money,,pour, We poured money into the education of our children .,1,1,money has propertygood money is at locationbank money is used forbuy thing pour desires light. pour is at location kitchen. pour is used for quench your thirst.  We poured money into the education of our children .,38
376,crisis,,precipitate, The crisis precipitated by Russia 's revolution .,2,1,crisis has propertybad crisis is at locationwar crisis is used forcontrol situation precipitate desires crash. precipitate is at location thunderstorm. precipitate is used for kill person.  The crisis precipitated by Russia 's revolution .,36
377,economy,,precipitate, Our economy precipitated into complete ruin .,2,1,economy has propertybad economy is at locationcity economy is used forbuy thing precipitate desires crash. precipitate is at location thunderstorm. precipitate is used for kill person.  Our economy precipitated into complete ruin .,35
378,train,,precipitate, The bridge broke and precipitated the train into the river below .,4,1,train has propertynoisy train is at locationtrain station train is used fortravel precipitate desires crash. precipitate is at location thunderstorm. precipitate is used for kill person.  The bridge broke and precipitated the train into the river below .,42
379,peace,,preserve, preserve the peace in the family .,0,1,peace has propertygood peace is at locationcountry peace is used forpeace preserve desires good life. preserve is at location jar. preserve is used for preserve food.  preserve the peace in the family .,33
380,forest,,preserve, preserve the forest and the lakes .,0,0,forest has propertygreen forest is at locationcountryside forest is used forshelter preserve desires good life. preserve is at location jar. preserve is used for preserve food.  preserve the forest and the lakes .,33
381,finger,,prick, The nurse pricked my finger to get a small blood sample .,2,0,finger has propertylong finger is at locationfinger finger is used forpoint prick desires fuck. prick is at location your finger. prick is used for prick someone.  The nurse pricked my finger to get a small blood sample .,40
382,skin,,prick, The needle pricked his skin .,2,0,skin has propertysoft skin is at locationyour finger skin is used forcover your body prick desires fuck. prick is at location your finger. prick is used for prick someone.  The needle pricked his skin .,37
383,conscience,,prick, The thought of her unhappiness pricked his conscience .,5,1,conscience has propertygood conscience is at locationconfession conscience is used forjustify crime prick desires fuck. prick is at location your finger. prick is used for prick someone.  The thought of her unhappiness pricked his conscience .,41
384,ego,,puff, The sudden fame puffed her ego .,3,1,ego has propertygood ego is at locationperson ego is used formanipulate puff desires be light than air. puff is at location air. puff is used for blow.  The sudden fame puffed her ego .,37
385,critic,,puff, The critics puffed up this Broadway production .,2,1,critic has propertygood critic is at locationshow critic is used forportray something puff desires be light than air. puff is at location air. puff is used for blow.  The critics puffed up this Broadway production .,38
386,face,,puff, Her faced puffed up from the drugs .,2,0,face has propertyround face is at locationface face is used forlook at thing puff desires be light than air. puff is at location air. puff is used for blow.  Her faced puffed up from the drugs .,39
387,bullet,,pump, He pumped bullets into the dummy .,1,1,bullet has propertydangerous bullet is at locationgun bullet is used forkill pump desires pump. pump is at location pump. pump is used for pump gas.  He pumped bullets into the dummy .,33
388,athlete,,pump, The athlete pumps weights in the gym .,2,0,athlete has propertyvery competitive athlete is at locationsoccer game athlete is used forplay sport pump desires pump. pump is at location pump. pump is used for pump gas.  The athlete pumps weights in the gym .,38
389,witness,,pump, She pumped the witnesses for information .,1,1,witness has propertyimportant witness is at locationtrial witness is used forjudge pump desires pump. pump is at location pump. pump is used for pump gas.  She pumped the witnesses for information .,33
390,table,,push, He pushed the table into a corner .,1,0,table has propertyround table is at locationin restaurant table is used foreat at push desires win. push is at location desk. push is used for move something.  He pushed the table into a corner .,36
391,woman,,push," "" Now push hard "" , said the doctor to the woman .",2,0,"woman has propertywalk along beach woman is at locationbed woman is used forhave sex push desires win. push is at location desk. push is used for move something.  "" Now push hard "" , said the doctor to the woman .",43
392,salesman,,push, The salesman is aggressively pushing the new computer model .,4,1,salesman has propertyhelpful salesman is at locationmall salesman is used forsell product push desires win. push is at location desk. push is used for move something.  The salesman is aggressively pushing the new computer model .,40
393,fifty,,push, She is pushing fifty .,2,1,fifty has propertylucky fifty is at locationworld fifty is used formake money push desires win. push is at location desk. push is used for move something.  She is pushing fifty .,33
394,reform,,push, The liberal party pushed for reforms .,3,1,reform has propertybad reform is at locationschool reform is used forchange push desires win. push is at location desk. push is used for move something.  The liberal party pushed for reforms .,35
395,drug,,push, The guy hanging around the school is pushing drugs .,7,1,drug has propertybad drug is at locationpharmacy drug is used forget high push desires win. push is at location desk. push is used for move something.  The guy hanging around the school is pushing drugs .,43
396,crowd,,push, The crowd pushed forward .,2,0,crowd has propertynoisy crowd is at locationstadium crowd is used forwatch sport push desires win. push is at location desk. push is used for move something.  The crowd pushed forward .,33
397,sun,,radiate, The sun radiates heat .,2,0,sun has propertybright sun is at locationsky sun is used forenergy radiate desires light. radiate is at location room. radiate is used for energy.  The sun radiates heat .,31
398,heat,,radiate, The sun radiates heat .,2,0,heat has propertyhot heat is at locationoven heat is used forcook radiate desires light. radiate is at location room. radiate is used for energy.  The sun radiates heat .,31
399,happiness,,radiate, She radiates happiness .,1,1,happiness has propertygood happiness is at locationhome happiness is used forhappiness radiate desires light. radiate is at location room. radiate is used for energy.  She radiates happiness .,29
400,police,,raid, The police raided the crack house .,2,0,police has propertycorrupt police is at locationroadblock police is used forprotect person raid desires plunder. raid is at location war. raid is used for murder.  The police raided the crack house .,34
401,pirate,,raid, The pirates raided the coastal villages regularly .,2,0,pirate has propertypirate pirate is at locationship pirate is used forpirate raid desires plunder. raid is at location war. raid is used for murder.  The pirates raided the coastal villages regularly .,34
402,company,,raid, T. Boone Pickens raided many large companies .,3,0,company has propertycorrupt company is at locationcity company is used formake money raid desires plunder. raid is at location war. raid is used for murder.  T. Boone Pickens raided many large companies .,36
403,refrigerator,,raid, Our babysitter raided our refrigerator .,2,1,refrigerator has propertyhot refrigerator is at locationkitchen refrigerator is used forkeep food cold raid desires plunder. raid is at location war. raid is used for murder.  Our babysitter raided our refrigerator .,34
404,feeling,,recapture, She could not recapture that feeling of happiness .,3,1,feeling has propertyuncomfortable feeling is at locationyour finger feeling is used formake thing recapture desires freedom. recapture is at location war. recapture is used for get away from government.  She could not recapture that feeling of happiness .,41
405,idea,,recapture, The author recaptures an old idea here .,2,1,idea has propertyimportant idea is at locationchurch idea is used forunderstand recapture desires freedom. recapture is at location war. recapture is used for get away from government.  The author recaptures an old idea here .,37
406,fort,,recapture, The military forces managed to recapture the fort .,5,0,fort has propertylarge fort is at locationindia fort is used forprotect your country recapture desires freedom. recapture is at location war. recapture is used for get away from government.  The military forces managed to recapture the fort .,43
407,prisoner,,recapture, They tried to recapture the escaped prisoner .,3,0,prisoner has propertydangerous prisoner is at locationprison prisoner is used forpunishment recapture desires freedom. recapture is at location war. recapture is used for get away from government.  They tried to recapture the escaped prisoner .,38
408,bell,,recast, The bell cracked and had to be recast .,7,0,bell has propertyloud bell is at locationschool bell is used forsummon someone recast desires be cast out. recast is at location television. recast is used for watch tv.  The bell cracked and had to be recast .,44
409,image,,recast, She had to recast her image to please the electorate in her home state .,3,1,image has propertyreflective image is at locationmovie image is used fordescribe thing recast desires be cast out. recast is at location television. recast is used for watch tv.  She had to recast her image to please the electorate in her home state .,46
410,fame,,redound, Fame redounds to the heroes .,1,1,fame has propertygood fame is at locationmovie fame is used forfame redound desires win. redound is at location country. redound is used for drive car.  Fame redounds to the heroes .,32
411,effort,,redound, Her efforts will redound to the general good .,3,1,effort has propertyimportant effort is at locationwork effort is used foraccomplish goal redound desires win. redound is at location country. redound is used for drive car.  Her efforts will redound to the general good .,38
412,belief,,reflect, This action reflects his true beliefs .,2,1,belief has propertyimportant belief is at locationchurch belief is used forjustify action reflect desires be understand. reflect is at location rainbow. reflect is used for insight.  This action reflects his true beliefs .,35
413,sound,,reflect, Sound is reflected well in this auditorium .,2,0,sound has propertyloud sound is at locationopera sound is used forcommunicate reflect desires be understand. reflect is at location rainbow. reflect is used for insight.  Sound is reflected well in this auditorium .,35
414,road,,reflect, Drive carefully -- the wet road reflects .,6,0,road has propertyconfuse road is at locationcountry road is used fordrive reflect desires be understand. reflect is at location rainbow. reflect is used for insight.  Drive carefully -- the wet road reflects .,39
415,image,,reflect, her sunglasses reflected his image .,2,0,image has propertyreflective image is at locationmovie image is used fordescribe thing reflect desires be understand. reflect is at location rainbow. reflect is used for insight.  her sunglasses reflected his image .,34
416,interest,,reflect, His lack of interest in the project reflects badly on him .,7,1,interest has propertyinterest interest is at locationschool interest is used forentertainment reflect desires be understand. reflect is at location rainbow. reflect is used for insight.  His lack of interest in the project reflects badly on him .,44
417,mess,,reflect, The mess in his dorm room reflects on the student .,6,1,mess has propertymessy mess is at locationdesk mess is used formake mess reflect desires be understand. reflect is at location rainbow. reflect is used for insight.  The mess in his dorm room reflects on the student .,43
418,system,,reform, reform a political system .,0,0,system has propertycomplex system is at locationcomputer system is used forcontrol reform desires change society. reform is at location school. reform is used for change.  reform a political system .,30
419,tension,,relax, relax the tension on the rope .,0,0,tension has propertybad tension is at locationairport tension is used forcontrol relax desires relax. relax is at location beach. relax is used for relax.  relax the tension on the rope .,31
420,bath,,relax, A hot bath always relaxes me .,4,0,bath has propertyhot bath is at locationbathroom bath is used forwash relax desires relax. relax is at location beach. relax is used for relax.  A hot bath always relaxes me .,35
421,colleague,,relax, our new colleague relaxed when he saw that we were a friendly group .,3,0,colleague has propertyhelpful colleague is at locationoffice colleague is used forhelp relax desires relax. relax is at location beach. relax is used for relax.  our new colleague relaxed when he saw that we were a friendly group .,41
422,government,,relax, The government relaxed the curfew after most of the rebels were caught .,2,1,government has propertycorrupt government is at locationdemocracy government is used forcontrol relax desires relax. relax is at location beach. relax is used for relax.  The government relaxed the curfew after most of the rebels were caught .,39
423,rule,,relax, The rules relaxed after the new director arrived .,2,1,rule has propertyimportant rule is at locationschool rule is used forenforce law relax desires relax. relax is at location beach. relax is used for relax.  The rules relaxed after the new director arrived .,36
424,suffering,,repair, One can never fully repair the suffering and losses of the Jews in the Third Reich .,4,1,suffering has propertybad suffering is at locationhospital suffering is used forprolong life repair desires fix. repair is at location repair shop. repair is used for make car.  One can never fully repair the suffering and losses of the Jews in the Third Reich .,48
425,man,,revive, The doctors revived the comatose man .,2,0,man has propertymale man is at locationoffice man is used forlove revive desires live. revive is at location funeral. revive is used for revive body.  The doctors revived the comatose man .,34
426,soup,,revive, A hot soup will revive me .,4,1,soup has propertygood soup is at locationpantry soup is used foreat revive desires live. revive is at location funeral. revive is used for revive body.  A hot soup will revive me .,36
427,interest,,revive, Interest in ESP revived .,3,1,interest has propertyinterest interest is at locationschool interest is used forentertainment revive desires live. revive is at location funeral. revive is used for revive body.  Interest in ESP revived .,33
428,style,,revive, He revived this style of opera .,1,1,style has propertyimportant style is at locationart gallery style is used formake art revive desires live. revive is at location funeral. revive is used for revive body.  He revived this style of opera .,35
429,curtain,,rip, The curtain ripped from top to bottom .,2,0,curtain has propertytransparent curtain is at locationtheater curtain is used forprivacy rip desires eat. rip is at location seam. rip is used for remove clothe.  The curtain ripped from top to bottom .,35
430,tornado,,rip, The tornado ripped along the coast .,2,1,tornado has propertyscary tornado is at locationoklahoma tornado is used fordestroy rip desires eat. rip is at location seam. rip is used for remove clothe.  The tornado ripped along the coast .,34
431,candidate,,rip, The candidate ripped into his opponent mercilessly .,2,1,candidate has propertyelect candidate is at locationconference candidate is used forelect rip desires eat. rip is at location seam. rip is used for remove clothe.  The candidate ripped into his opponent mercilessly .,35
432,plant,,root, this plant roots quickly .,2,0,plant has propertygreen plant is at locationgarden plant is used forgrow food root desires water. root is at location root of tree. root is used for grow plant.  this plant roots quickly .,35
433,problem,,root, The problem roots in her depression .,2,1,problem has propertybad problem is at locationoffice problem is used forsolve root desires water. root is at location root of tree. root is used for grow plant.  The problem roots in her depression .,36
434,pig,,root, the pig was rooting for truffles .,3,0,pig has propertyvery smart pig is at locationfarm pig is used foreat root desires water. root is at location root of tree. root is used for grow plant.  the pig was rooting for truffles .,38
435,soprano,,rotate, We rotate the lead soprano every night .,1,1,soprano has propertysing soprano is at locationchoir soprano is used forsing rotate desires be use. rotate is at location music store. rotate is used for rotate.  We rotate the lead soprano every night .,35
436,intern,,rotate, Interns have to rotate for a few months .,3,1,intern has propertybore intern is at locationoffice intern is used forwork rotate desires be use. rotate is at location music store. rotate is used for rotate.  Interns have to rotate for a few months .,38
437,crop,,rotate, We rotate the crops so as to maximize the use of the soil .,1,1,crop has propertygreen crop is at locationfield crop is used forgrow food rotate desires be use. rotate is at location music store. rotate is used for rotate.  We rotate the crops so as to maximize the use of the soil .,42
438,composure,,ruffle, She wanted to ruffle his composure .,3,1,composure has propertybad composure is at locationdinner composure is used forcontrol anger ruffle desires your hair. ruffle is at location skirt. ruffle is used for keep your hair out of eye.  She wanted to ruffle his composure .,41
439,people,,ruffle, This play is going to ruffle some people .,5,1,people has propertyselfish people is at locationbus stop people is used forwork ruffle desires your hair. ruffle is at location skirt. ruffle is used for keep your hair out of eye.  This play is going to ruffle some people .,45
440,feather,,ruffle, The bird ruffled its feathers .,2,0,feather has propertysoft feather is at locationbird nest feather is used fordecoration ruffle desires your hair. ruffle is at location skirt. ruffle is used for keep your hair out of eye.  The bird ruffled its feathers .,39
441,surface,,ruffle, The wind ruffled the surface of the water .,2,0,surface has propertyflat surface is at locationocean surface is used forhold thing together ruffle desires your hair. ruffle is at location skirt. ruffle is used for keep your hair out of eye.  The wind ruffled the surface of the water .,43
442,fabric,,ruffle, The seamstress ruffled the curtain fabric .,2,0,fabric has propertyweave fabric is at locationsew room fabric is used formake curtain ruffle desires your hair. ruffle is at location skirt. ruffle is used for keep your hair out of eye.  The seamstress ruffled the curtain fabric .,41
443,car,,ruin, You have ruined my car by pouring sugar in the tank !,2,0,car has propertydangerous car is at locationin garage car is used fortravel ruin desires win. ruin is at location forest. ruin is used for recycle.  You have ruined my car by pouring sugar in the tank !,39
444,chance,,ruin, This behavior will ruin your chances of winning the election .,3,1,chance has propertyunpredictable chance is at locationfuture chance is used forwin ruin desires win. ruin is at location forest. ruin is used for recycle.  This behavior will ruin your chances of winning the election .,38
445,field,,salt, the rebels had salted the fields with mines and traps .,3,1,field has propertygreen field is at locationcountryside field is used forgrow food salt desires salt. salt is at location ocean. salt is used for flavor food.  the rebels had salted the fields with mines and traps .,40
446,lecture,,salt, She salts her lectures with jokes .,1,1,lecture has propertybore lecture is at locationschool lecture is used forlearn salt desires salt. salt is at location ocean. salt is used for flavor food.  She salts her lectures with jokes .,33
447,meat,,salt, people used to salt meats on ships .,3,0,meat has propertygood meat is at locationrefrigerator meat is used forcook salt desires salt. salt is at location ocean. salt is used for flavor food.  people used to salt meats on ships .,36
448,courage,,salute, I salute your courage !,1,1,courage has propertyimportant courage is at locationchurch courage is used forfight injustice salute desires person to salute. salute is at location post office. salute is used for honor.  I salute your courage !,34
449,stench,,salute, a terrible stench saluted our nostrils .,3,1,stench has propertyunpleasant stench is at locationsewer stench is used forkill salute desires person to salute. salute is at location post office. salute is used for honor.  a terrible stench saluted our nostrils .,37
450,soldier,,salute," When the officers show up , the soldiers have to salute .",10,0,"soldier has propertydangerous soldier is at locationmilitary base soldier is used forfight salute desires person to salute. salute is at location post office. salute is used for honor.  When the officers show up , the soldiers have to salute .",50
451,X-ray,,scan, the surgeon scanned the X - ray .,2,0,X-ray has propertyharmful to eye X-ray is at locationairport X-ray is used forsee inside person scan desires win. scan is at location computer. scan is used for find something out.  the surgeon scanned the X - ray .,40
452,headline,,scan, She scanned the newspaper headlines while waiting for the taxi .,1,1,headline has propertyread by person headline is at locationnewspaper headline is used forread scan desires win. scan is at location computer. scan is used for find something out.  She scanned the newspaper headlines while waiting for the taxi .,40
453,sky,,scan, The beams scanned the night sky .,2,1,sky has propertyblack at night sky is at locationsky sky is used forfly scan desires win. scan is at location computer. scan is used for find something out.  The beams scanned the night sky .,37
454,heat,,scorch, The heat scorched the countryside .,2,1,heat has propertyhot heat is at locationoven heat is used forcook scorch desires eat human flesh. scorch is at location fire. scorch is used for cook.  The heat scorched the countryside .,34
455,forest,,scorch, The wildfire scorched the forest and several homes .,2,0,forest has propertygreen forest is at locationcountryside forest is used forshelter scorch desires eat human flesh. scorch is at location fire. scorch is used for cook.  The wildfire scorched the forest and several homes .,37
456,cat,,scrape, The cat scraped at the armchair .,2,0,cat has propertycurious about flower cat is at locationyour lap cat is used forpet scrape desires scratch. scrape is at location table. scrape is used for remove dirt.  The cat scraped at the armchair .,37
457,letter,,scrape, They scraped a letter into the stone .,1,0,letter has propertywrite on paper letter is at locationmail box letter is used forcommunication scrape desires scratch. scrape is at location table. scrape is used for remove dirt.  They scraped a letter into the stone .,37
458,money,,scrape, She had scraped together enough money for college .,2,1,money has propertygood money is at locationbank money is used forbuy thing scrape desires scratch. scrape is at location table. scrape is used for remove dirt.  She had scraped together enough money for college .,37
459,money,,seize, The sales clerk quickly seized the money on the counter .,4,0,money has propertygood money is at locationbank money is used forbuy thing seize desires win. seize is at location desk. seize is used for hurt someone.  The sales clerk quickly seized the money on the counter .,41
460,invader,,seize, the invaders seized the land and property of the inhabitants .,2,0,invader has propertyevil invader is at locationwar invader is used forinvade seize desires win. seize is at location desk. seize is used for hurt someone.  the invaders seized the land and property of the inhabitants .,38
461,fear,,seize, Fear seized the prisoners .,1,1,fear has propertybad fear is at locationwar fear is used forfear seize desires win. seize is at location desk. seize is used for hurt someone.  Fear seized the prisoners .,31
