,arg1,arg2,verb,sentence,verb_idx,label,new_sentences,new_ind
0,knowledge,,absorb, He absorbed the knowledge or beliefs of his tribe .,1,1,knowledge has propertyimportant knowledge is at locationschool knowledge is used forlearn absorb desires be touch. absorb is at location jar. absorb is used for make something.  He absorbed the knowledge or beliefs of his tribe .,37
1,cost,,absorb, He absorbed the costs for the accident .,1,1,cost has propertybad cost is at locationbank cost is used forbuy thing absorb desires be touch. absorb is at location jar. absorb is used for make something.  He absorbed the costs for the accident .,36
2,tax,,absorb, The sales tax is absorbed into the state income tax .,4,1,tax has propertybad tax is at locationbank tax is used forpay tax absorb desires be touch. absorb is at location jar. absorb is used for make something.  The sales tax is absorbed into the state income tax .,42
3,immigrant,,absorb, The immigrants were quickly absorbed into society .,4,1,immigrant has propertyethnic immigrant is at locationcity immigrant is used forwork absorb desires be touch. absorb is at location jar. absorb is used for make something.  The immigrants were quickly absorbed into society .,38
4,interest,,absorb, Her interest in butterflies absorbs her completely .,4,1,interest has propertyinterest interest is at locationschool interest is used forentertainment absorb desires be touch. absorb is at location jar. absorb is used for make something.  Her interest in butterflies absorbs her completely .,38
5,workers,,abuse, This boss abuses his workers .,2,0,workers has propertylazy workers is at locationwork workers is used forwork abuse desires be free. abuse is at location jail. abuse is used for get what you want.  This boss abuses his workers .,36
6,system,,abuse, Do n't abuse the system .,2,1,system has propertycomplex system is at locationcomputer system is used forcontrol abuse desires be free. abuse is at location jail. abuse is used for get what you want.  Do n't abuse the system .,36
7,policeman,,abuse, The actress abused the policeman who gave her a parking ticket .,2,0,policeman has propertydangerous policeman is at locationroadblock policeman is used forenforce law abuse desires be free. abuse is at location jail. abuse is used for get what you want.  The actress abused the policeman who gave her a parking ticket .,43
8,alcohol,,abuse, Her husband often abuses alcohol .,3,1,alcohol has propertybad for you alcohol is at locationbar alcohol is used fordrink abuse desires be free. abuse is at location jail. abuse is used for get what you want.  Her husband often abuses alcohol .,39
9,guest,,accommodate, This hotel can accommodate 250 guests .,3,0,guest has propertyentertain guest is at locationhotel guest is used forrelaxation accommodate desires be satisfy. accommodate is at location church. accommodate is used for accommodate person.  This hotel can accommodate 250 guests .,36
10,result,,accommodate, The scientists had to accommodate the new results with the existing theories .,4,1,result has propertybad result is at locationmath result is used formake something accommodate desires be satisfy. accommodate is at location church. accommodate is used for accommodate person.  The scientists had to accommodate the new results with the existing theories .,44
11,submission,,acknowledge, The program committee acknowledged the submission of the authors of the paper .,3,0,submission has propertygood submission is at locationoffice submission is used forget what you want acknowledge desires be good. acknowledge is at location church. acknowledge is used for make friend.  The program committee acknowledged the submission of the authors of the paper .,45
12,colleague,,acknowledge, He never acknowledges his colleagues when they run into him in the hallway .,2,0,colleague has propertyhelpful colleague is at locationoffice colleague is used forhelp acknowledge desires be good. acknowledge is at location church. acknowledge is used for make friend.  He never acknowledges his colleagues when they run into him in the hallway .,42
13,kindness,,acknowledge, We must acknowledge the kindness she showed towards us .,2,0,kindness has propertygood kindness is at locationfriend kindness is used formake person feel good acknowledge desires be good. acknowledge is at location church. acknowledge is used for make friend.  We must acknowledge the kindness she showed towards us .,41
14,deed,,acknowledge, acknowledge the deed .,0,0,deed has propertyimportant deed is at locationbank deed is used formake money acknowledge desires be good. acknowledge is at location church. acknowledge is used for make friend.  acknowledge the deed .,31
15,prince,,acknowledge, The Crown Prince was acknowledged as the true heir to the throne .,4,0,prince has propertymale prince is at locationcastle prince is used forplay chess acknowledge desires be good. acknowledge is at location church. acknowledge is used for make friend.  The Crown Prince was acknowledged as the true heir to the throne .,44
16,resident,,adhere, The residents of this village adhered to Catholicism .,5,1,resident has propertylazy resident is at locationapartment resident is used forlive in adhere desires clean air. adhere is at location office. adhere is used for keep thing clean.  The residents of this village adhered to Catholicism .,42
17,wallpaper,,adhere, Will this wallpaper adhere to the wall ?,3,0,wallpaper has propertywhite wallpaper is at locationwall wallpaper is used fordecorate room adhere desires clean air. adhere is at location office. adhere is used for keep thing clean.  Will this wallpaper adhere to the wall ?,39
18,steering,,answer, The steering of my new car answers to the slightest touch .,6,1,steering has propertyhard steering is at locationcar steering is used forsteer car answer desires answer. answer is at location newspaper. answer is used for get information.  The steering of my new car answers to the slightest touch .,44
19,telephone,,answer, answer the telephone .,0,0,telephone has propertyold telephone is at locationin office telephone is used forcall someone answer desires answer. answer is at location newspaper. answer is used for get information.  answer the telephone .,31
20,question,,answer, The question concerning the meaning of life can not be answered .,10,0,question has propertyimportant question is at locationnewspaper question is used forfind truth answer desires answer. answer is at location newspaper. answer is used for get information.  The question concerning the meaning of life can not be answered .,48
21,defendant,,answer, The defendant answered to all the charges of the prosecution .,2,0,defendant has propertyguilty of crime defendant is at locationcourtroom defendant is used forprosecute crime answer desires answer. answer is at location newspaper. answer is used for get information.  The defendant answered to all the charges of the prosecution .,41
22,mountain,,ascend, We ascended the mountain .,1,0,mountain has propertyvery tall mountain is at locationmountain mountain is used forclimb ascend desires fly. ascend is at location elevator. ascend is used for go up.  We ascended the mountain .,32
23,inheritance,,ascend, Inheritance may not ascend linearly .,3,1,inheritance has propertyimportant inheritance is at locationbank inheritance is used forkeep person alive ascend desires fly. ascend is at location elevator. ascend is used for go up.  Inheritance may not ascend linearly .,36
24,path,,ascend, The path ascended to the top of the hill .,2,0,path has propertyuphill path is at locationforest path is used forgo somewhere ascend desires fly. ascend is at location elevator. ascend is used for go up.  The path ascended to the top of the hill .,38
25,poland,,attack," Hitler attacked Poland on September 1 , 1939 and started World War II .",1,0,"poland has propertysouth of europe poland is at locationin europe poland is used forinvade poland attack desires win war. attack is at location war. attack is used for intimidate.  Hitler attacked Poland on September 1 , 1939 and started World War II .",44
26,speaker,,attack, The editors of the left - leaning paper attacked the new House Speaker .,8,1,speaker has propertyloud speaker is at locationoffice speaker is used formake sound attack desires win war. attack is at location war. attack is used for intimidate.  The editors of the left - leaning paper attacked the new House Speaker .,48
27,village,,attack, The Serbs attacked the village at night .,2,0,village has propertyfun village is at locationcountry village is used forlive in attack desires win war. attack is at location war. attack is used for intimidate.  The Serbs attacked the village at night .,36
28,problem,,attack, I attacked the problem as soon as I got out of bed .,1,1,problem has propertybad problem is at locationoffice problem is used forsolve attack desires win war. attack is at location war. attack is used for intimidate.  I attacked the problem as soon as I got out of bed .,39
29,cancer,,attack, The cancer cells are attacking his liver .,4,1,cancer has propertybad cancer is at locationhospital cancer is used forkill attack desires win war. attack is at location war. attack is used for intimidate.  The cancer cells are attacking his liver .,37
30,vienna,,besiege, The Turks besieged Vienna .,2,0,vienna has propertyfamous for it chocolate vienna is at locationaustria vienna is used forvienna besiege desires kill person. besiege is at location war. besiege is used for kill person.  The Turks besieged Vienna .,36
31,problem,,besiege, She was besieged by so many problems that she got discouraged .,2,1,problem has propertybad problem is at locationoffice problem is used forsolve besiege desires kill person. besiege is at location war. besiege is used for kill person.  She was besieged by so many problems that she got discouraged .,40
32,press,,besiege, The press photographers besieged the movie star .,3,1,press has propertyimportant press is at locationtelevision press is used fortransmit information besiege desires kill person. besiege is at location war. besiege is used for kill person.  The press photographers besieged the movie star .,38
33,foot,,bind, The Chinese would bind the feet of their women .,3,0,foot has propertylong foot is at locationshoe foot is used forwalk bind desires bind. bind is at location hospital. bind is used for bind.  The Chinese would bind the feet of their women .,37
34,book,,bind, They bind their books in leather .,1,0,book has propertyheavy book is at locationlibrary book is used forlearn bind desires bind. bind is at location hospital. bind is used for bind.  They bind their books in leather .,32
35,oxygen,,bind, The hydrogen binds the oxygen .,2,1,oxygen has propertyessential to life oxygen is at locationair oxygen is used forlife bind desires bind. bind is at location hospital. bind is used for bind.  The hydrogen binds the oxygen .,34
36,meteor,,blaze, Meteors blazed across the atmosphere .,1,1,meteor has propertyvery large meteor is at locationspace meteor is used fortravel between solar system blaze desires burn. blaze is at location fire. blaze is used for burn.  Meteors blazed across the atmosphere .,35
37,pine,,blaze, The summer sun alone can cause a pine to blaze .,9,0,pine has propertygreen pine is at locationforest pine is used formake campfire blaze desires burn. blaze is at location fire. blaze is used for burn.  The summer sun alone can cause a pine to blaze .,45
38,spaceship,,blaze, The spaceship blazed out into space .,2,1,spaceship has propertyfast spaceship is at locationspace spaceship is used fortravel blaze desires burn. blaze is at location fire. blaze is used for burn.  The spaceship blazed out into space .,33
39,foot,,blister, Her feet blistered during the long hike .,2,0,foot has propertylong foot is at locationshoe foot is used forwalk blister desires burn. blister is at location finger. blister is used for burn.  Her feet blistered during the long hike .,34
40,administration,,blister, The Senator blistered the administration in his speech on Friday .,2,1,administration has propertyimportant administration is at locationschool administration is used fororganize information blister desires burn. blister is at location finger. blister is used for burn.  The Senator blistered the administration in his speech on Friday .,38
41,haze,,blur, The haze blurs the hills .,2,0,haze has propertycool haze is at locationthunderstorm haze is used forclear vision blur desires play. blur is at location movie. blur is used for correct mistake.  The haze blurs the hills .,34
42,vision,,blur, The fog blurs my vision .,2,0,vision has propertyvery important vision is at locationbook vision is used forsee blur desires play. blur is at location movie. blur is used for correct mistake.  The fog blurs my vision .,34
43,distinction,,blur, The distinction between the two theories blurred .,6,1,distinction has propertybad distinction is at locationchurch distinction is used formake person feel good blur desires play. blur is at location movie. blur is used for correct mistake.  The distinction between the two theories blurred .,42
44,listener,,bolt, The listeners bolted when he discussed his strange ideas .,2,1,listener has propertyimportant listener is at locationconference listener is used forlisten bolt desires be clean. bolt is at location garage. bolt is used for fasten thing together.  The listeners bolted when he discussed his strange ideas .,39
45,food,,bolt, Do n't bolt your food !,2,1,food has propertygood food is at locationpantry food is used fornutrition bolt desires be clean. bolt is at location garage. bolt is used for fasten thing together.  Do n't bolt your food !,35
46,economy,,boost, The tax cut will boost the economy .,4,1,economy has propertybad economy is at locationcity economy is used forbuy thing boost desires win. boost is at location bridge. boost is used for lift something.  The tax cut will boost the economy .,38
47,voltage,,boost, Boost the voltage in an electrical circuit .,0,0,voltage has propertydangerous voltage is at locationelectrical circuit voltage is used forelectricity boost desires win. boost is at location bridge. boost is used for lift something.  Boost the voltage in an electrical circuit .,34
48,singer,,boost, The singer had to be boosted onto the stage by a special contraption .,5,0,singer has propertysing singer is at locationopera singer is used forsing boost desires win. boost is at location bridge. boost is used for lift something.  The singer had to be boosted onto the stage by a special contraption .,44
49,ball,,bounce, The rubber ball bounced .,3,0,ball has propertyround ball is at locationtoy store ball is used forplay basketball bounce desires win. bounce is at location park. bounce is used for exercise.  The rubber ball bounced .,34
50,people,,bounce, The ex - boxer 's job is to bounce people who want to enter this private club .,8,1,people has propertyselfish people is at locationbus stop people is used forwork bounce desires win. bounce is at location park. bounce is used for exercise.  The ex - boxer 's job is to bounce people who want to enter this private club .,51
51,government,,bow, The government bowed to the military pressure .,2,1,government has propertycorrupt government is at locationdemocracy government is used forcontrol bow desires be gift. bow is at location boat. bow is used for tie bow.  The government bowed to the military pressure .,36
52,life,,breathe, He breathed new life into the old house .,1,1,life has propertyfragile life is at locationearth life is used forlive breathe desires live. breathe is at location hospital. breathe is used for live.  He breathed new life into the old house .,34
53,fabric,,breathe, Our new synthetic fabric breathes and is perfect for summer wear .,4,1,fabric has propertyweave fabric is at locationsew room fabric is used formake curtain breathe desires live. breathe is at location hospital. breathe is used for live.  Our new synthetic fabric breathes and is perfect for summer wear .,42
54,hair,,brush, Johnson brushed the hairs from his jacket .,1,0,hair has propertycurly hair is at locationyour head hair is used forwash brush desires brush tooth. brush is at location bathroom. brush is used for clean your hair.  Johnson brushed the hairs from his jacket .,37
55,wall,,brush, He brushed the wall lightly .,1,0,wall has propertyvertical wall is at locationwall wall is used fordivide room brush desires brush tooth. brush is at location bathroom. brush is used for clean your hair.  He brushed the wall lightly .,35
56,suit,,brush, She brushed the suit before hanging it back into the closet .,1,0,suit has propertyexpensive suit is at locationsuitcase suit is used forprotect your body brush desires brush tooth. brush is at location bathroom. brush is used for clean your hair.  She brushed the suit before hanging it back into the closet .,42
57,suspense,,build, Suspense was building right from the beginning of the opera .,2,1,suspense has propertyexcite suspense is at locationtheatre suspense is used formake person nervous build desires build. build is at location build. build is used for shelter.  Suspense was building right from the beginning of the opera .,39
58,school,,build, The government is building new schools in this state .,3,0,school has propertyfun school is at locationtown school is used forteach build desires build. build is at location build. build is used for shelter.  The government is building new schools in this state .,37
59,nation,,build, build a modern nation .,0,1,nation has propertycorrupt nation is at locationworld nation is used forgovern build desires build. build is at location build. build is used for shelter.  build a modern nation .,29
60,architect,,build, These architects build in interesting and new styles .,2,0,architect has propertyold architect is at locationbuild architect is used forbuild build desires build. build is at location build. build is used for shelter.  These architects build in interesting and new styles .,35
61,defense,,build, build a defense on nothing but the accused person 's reputation .,0,1,defense has propertyimportant defense is at locationschool defense is used forprotect someone build desires build. build is at location build. build is used for shelter.  build a defense on nothing but the accused person 's reputation .,37
62,sum,,buy, This sum will buy you a ride on the train .,3,0,sum has propertyplural sum is at locationsum sum is used forsum buy desires buy thing. buy is at location supermarket. buy is used for buy thing.  This sum will buy you a ride on the train .,40
63,love,,buy, She wanted to buy his love with her dedication to him and his work .,3,0,love has propertygood love is at locationfamily love is used forgive buy desires buy thing. buy is at location supermarket. buy is used for buy thing.  She wanted to buy his love with her dedication to him and his work .,44
64,story,,buy, I ca n't buy this story .,3,1,story has propertyinaccurate story is at locationnewspaper story is used forentertainment buy desires buy thing. buy is at location supermarket. buy is used for buy thing.  I ca n't buy this story .,36
65,bee,,buzz, bees were buzzing around the hive .,2,0,bee has propertysmall bee is at locationflower bee is used forfly buzz desires play game. buzz is at location stadium. buzz is used for fun.  bees were buzzing around the hive .,34
66,plane,,buzz, Planes buzzed the crowds in the square .,1,0,plane has propertyfly plane is at locationairport plane is used forfly buzz desires play game. buzz is at location stadium. buzz is used for fun.  Planes buzzed the crowds in the square .,34
67,office,,buzz, This office is buzzing with activity .,3,1,office has propertyclutter office is at locationoffice build office is used forwork buzz desires play game. buzz is at location stadium. buzz is used for fun.  This office is buzzing with activity .,36
68,servant,,buzz, he buzzed the servant .,1,1,servant has propertycourteous servant is at locationmansion servant is used forserve buzz desires play game. buzz is at location stadium. buzz is used for fun.  he buzzed the servant .,31
69,essence,,capture, capture the essence of Spring   .,0,1,essence has propertyimportant essence is at locationwater essence is used formake something capture desires get money. capture is at location circus. capture is used for punish criminal.  capture the essence of Spring   .,33
70,heart,,capture, She captured all the men 's hearts .,1,1,heart has propertystrong heart is at locationperson heart is used forlove capture desires get money. capture is at location circus. capture is used for punish criminal.  She captured all the men 's hearts .,35
71,neutron,,capture, This nucleus has captured the slow - moving neutrons .,3,0,neutron has propertyvery small neutron is at locationspace neutron is used forneutralise energy capture desires get money. capture is at location circus. capture is used for punish criminal.  This nucleus has captured the slow - moving neutrons .,41
72,way,,claw, They clawed their way to the top of the mountain .,1,1,way has propertymove way is at locationuniverse way is used forget something claw desires eat. claw is at location your arm. claw is used for scratch.  They clawed their way to the top of the mountain .,38
73,doorknob,,claw, She clawed the doorknob .,1,1,doorknob has propertyopen doorknob is at locationfront door doorknob is used foropen door claw desires eat. claw is at location your arm. claw is used for scratch.  She clawed the doorknob .,33
74,rival,,claw, The politician clawed his rival .,2,1,rival has propertybad rival is at locationwar rival is used formake enemy claw desires eat. claw is at location your arm. claw is used for scratch.  The politician clawed his rival .,34
75,hill,,climb, Did you ever climb up the hill behind your house ?,3,0,hill has propertyflat hill is at locationcountryside hill is used forclimb climb desires climb mountain. climb is at location mountain. climb is used for get up mountain.  Did you ever climb up the hill behind your house ?,41
76,sale,,climb, Sales were climbing after prices were lowered .,2,1,sale has propertyexpensive sale is at locationshop sale is used forsell product climb desires climb mountain. climb is at location mountain. climb is used for get up mountain.  Sales were climbing after prices were lowered .,38
77,price,,climb, Sales were climbing after prices were lowered .,2,1,price has propertybad price is at locationbank price is used forbuy thing climb desires climb mountain. climb is at location mountain. climb is used for get up mountain.  Sales were climbing after prices were lowered .,38
78,path,,climb, The path climbed all the way to the top of the hill .,2,1,path has propertyuphill path is at locationforest path is used forgo somewhere climb desires climb mountain. climb is at location mountain. climb is used for get up mountain.  The path climbed all the way to the top of the hill .,43
79,drain,,clog, The leaves clog our drains in the Fall .,2,0,drain has propertyslippery drain is at locationdrain drain is used fordrain clog desires water. clog is at location drain. clog is used for drain.  The leaves clog our drains in the Fall .,35
80,horse,,clog, horses were clogged until they were tamed .,2,1,horse has propertybig horse is at locationkentucky derby horse is used forride clog desires water. clog is at location drain. clog is used for drain.  horses were clogged until they were tamed .,35
81,market,,clog, The market is being clogged by these operations .,4,1,market has propertyvery popular market is at locationcity market is used forbuy thing clog desires water. clog is at location drain. clog is used for drain.  The market is being clogged by these operations .,39
82,mind,,clog, Fear clogged her mind .,1,1,mind has propertygood mind is at locationyour head mind is used forthink clog desires water. clog is at location drain. clog is used for drain.  Fear clogged her mind .,31
83,smoke,,cloud, The smoke clouded above the houses .,2,0,smoke has propertybad for your health smoke is at locationfire smoke is used forkill bacteria cloud desires be extinguish. cloud is at location sky. cloud is used for make rain fall.  The smoke clouded above the houses .,40
84,face,,cloud, Their faces were clouded with sadness .,3,1,face has propertyround face is at locationface face is used forlook at thing cloud desires be extinguish. cloud is at location sky. cloud is used for make rain fall.  Their faces were clouded with sadness .,39
85,memory,,cloud, The stroke clouded memories of her youth .,2,1,memory has propertyimportant memory is at locationcomputer memory is used forremember cloud desires be extinguish. cloud is at location sky. cloud is used for make rain fall.  The stroke clouded memories of her youth .,37
86,liquid,,cloud, The chemical clouded the liquid to which it was added .,2,1,liquid has propertyliquid liquid is at locationcontainer liquid is used fordrink cloud desires be extinguish. cloud is at location sky. cloud is used for make rain fall.  The chemical clouded the liquid to which it was added .,40
87,idea,,color, His political ideas color his lectures .,3,1,idea has propertyimportant idea is at locationchurch idea is used forunderstand color desires be mix. color is at location rainbow. color is used for make picture.  His political ideas color his lectures .,36
88,wall,,color, color the walls with paint in warm tones .,0,0,wall has propertyvertical wall is at locationwall wall is used fordivide room color desires be mix. color is at location rainbow. color is used for make picture.  color the walls with paint in warm tones .,36
