,arg1,arg2,verb,sentence,verb_idx,label,new_sentences,new_ind
458,money,,scrape, She had scraped together enough money for college .,2,1,money has property good money is at location bank money is used for buy thing scrape desires scratch. scrape is at location table. scrape is used for remove dirt.  She had scraped together enough money for college .,40
459,money,,seize, The sales clerk quickly seized the money on the counter .,4,0,money has property good money is at location bank money is used for buy thing seize desires win. seize is at location desk. seize is used for hurt someone.  The sales clerk quickly seized the money on the counter .,44
460,invader,,seize, the invaders seized the land and property of the inhabitants .,2,0,invader has property evil invader is at location war invader is used for invade seize desires win. seize is at location desk. seize is used for hurt someone.  the invaders seized the land and property of the inhabitants .,41
461,fear,,seize, Fear seized the prisoners .,1,1,fear has property bad fear is at location war fear is used for fear seize desires win. seize is at location desk. seize is used for hurt someone.  Fear seized the prisoners .,34
462,book,,sell, These books sell like hot cakes .,2,0,book has property heavy book is at location library book is used for learn sell desires sell product. sell is at location market. sell is used for buy thing.  These books sell like hot cakes .,38
463,image,,sell, The French try to sell us their image as great lovers .,4,1,image has property reflective image is at location movie image is used for describe thing sell desires sell product. sell is at location market. sell is used for buy thing.  The French try to sell us their image as great lovers .,46
464,shoe,,sell, The brothers sell shoes .,2,0,shoe has property ugly shoe is at location closet shoe is used for protect foot from injury sell desires sell product. sell is at location market. sell is used for buy thing.  The brothers sell shoes .,39
465,hope,,shake, The bad news shook her hopes .,3,1,hope has property true hope is at location dream hope is used for hope shake desires drink. shake is at location restaurant. shake is used for greet person.  The bad news shook her hopes .,38
466,salt,,shake, Shake the salt out of the salt shaker .,0,0,salt has property white salt is at location ocean salt is used for flavor food shake desires drink. shake is at location restaurant. shake is used for greet person.  Shake the salt out of the salt shaker .,38
467,argument,,sharpen, We had to sharpen our arguments .,3,1,argument has property bad argument is at location argument argument is used for argument sharpen desires write. sharpen is at location desk. sharpen is used for sharpen.  We had to sharpen our arguments .,37
468,debate,,sharpen, The debate sharpened .,2,1,debate has property important debate is at location debate debate is used for debate sharpen desires write. sharpen is at location desk. sharpen is used for sharpen.  The debate sharpened .,33
469,vision,,sharpen, This drug will sharpen your vision .,3,1,vision has property very important vision is at location book vision is used for see sharpen desires write. sharpen is at location desk. sharpen is used for sharpen.  This drug will sharpen your vision .,38
470,image,,shed, He shed his image as a pushy boss .,1,1,image has property reflective image is at location movie image is used for describe thing shed desires clean air. shed is at location backyard. shed is used for store tool.  He shed his image as a pushy boss .,40
471,tear,,shed, She shed a lot of tears when this happened .,1,0,tear has property messy tear is at location your eye tear is used for cry shed desires clean air. shed is at location backyard. shed is used for store tool.  She shed a lot of tears when this happened .,41
472,dog,,shed, Our dog sheds every Spring .,2,0,dog has property loyal dog is at location your house dog is used for protect person shed desires clean air. shed is at location backyard. shed is used for store tool.  Our dog sheds every Spring .,39
473,career,,shipwreck, You have shipwrecked my career .,2,1,career has property important career is at location university career is used for get job shipwreck desires life. shipwreck is at location sea. shipwreck is used for ship.  You have shipwrecked my career .,36
474,vessel,,shipwreck, The vessel was shipwrecked .,3,0,vessel has property big vessel is at location ocean vessel is used for ship shipwreck desires life. shipwreck is at location sea. shipwreck is used for ship.  The vessel was shipwrecked .,35
475,praise,,shower, He was showered with praise .,2,1,praise has property good praise is at location church praise is used for make person feel good shower desires be clean. shower is at location bathroom. shower is used for wash.  He was showered with praise .,39
476,meteor,,shower, Meteors showered down over half of Australia .,1,0,meteor has property very large meteor is at location space meteor is used for travel between solar system shower desires be clean. shower is at location bathroom. shower is used for wash.  Meteors showered down over half of Australia .,41
477,present,,shower, He showered her with presents .,1,1,present has property fun present is at location box present is used for give to someone shower desires be clean. shower is at location bathroom. shower is used for wash.  He showered her with presents .,37
478,soldier,,sift, The soldiers sifted through the woods .,2,1,soldier has property dangerous soldier is at location military base soldier is used for fight sift desires open bottle of wine. sift is at location table. sift is used for remove dirt.  The soldiers sifted through the woods .,41
479,information,,sift, He sifted the information .,1,1,information has property useful information is at location newspaper information is used for learn sift desires open bottle of wine. sift is at location table. sift is used for remove dirt.  He sifted the information .,37
480,candidate,,sift, They sifted through the job candidates .,1,1,candidate has property elect candidate is at location conference candidate is used for elect sift desires open bottle of wine. sift is at location table. sift is used for remove dirt.  They sifted through the job candidates .,39
481,nightingale,,sing, The nightingale was singing .,3,0,nightingale has property very smart nightingale is at location zoo nightingale is used for sing sing desires make music. sing is at location opera. sing is used for entertainment.  The nightingale was singing .,37
482,kettle,,sing, the kettle was singing .,3,1,kettle has property hot kettle is at location stove kettle is used for boil water sing desires make music. sing is at location opera. sing is used for entertainment.  the kettle was singing .,37
483,court,,sit, When does the court of law sit ?,6,1,court has property important court is at location city court is used for judge sit desires be entertain. sit is at location table. sit is used for relaxation.  When does the court of law sit ?,42
484,house,,sit, The White House sits on Pennsylvania Avenue .,3,1,house has property build house is at location town house is used for live in sit desires be entertain. sit is at location table. sit is used for relaxation.  The White House sits on Pennsylvania Avenue .,40
485,car,,smash, She smashed her car against the guard rail .,1,0,car has property dangerous car is at location in garage car is used for travel smash desires win. smash is at location wall. smash is used for make music.  She smashed her car against the guard rail .,39
486,motorcycle,,smash, The motorcycle smashed into the guard rail .,2,0,motorcycle has property fun motorcycle is at location garage motorcycle is used for travel smash desires win. smash is at location wall. smash is used for make music.  The motorcycle smashed into the guard rail .,38
487,ring,,smash, The police smashed the drug ring after they were tipped off .,2,1,ring has property round ring is at location ring ring is used for decoration smash desires win. smash is at location wall. smash is used for make music.  The police smashed the drug ring after they were tipped off .,42
488,meat,,smother, smother the meat in gravy .,0,0,meat has property good meat is at location refrigerator meat is used for cook smother desires be free. smother is at location bed. smother is used for suffocate.  smother the meat in gravy .,34
489,cream,,smother, the butter cream smothered the cake .,3,1,cream has property sweet cream is at location fridge cream is used for make cream smother desires be free. smother is at location bed. smother is used for suffocate.  the butter cream smothered the cake .,39
490,disapproval,,snort, she snorted her disapproval of the proposed bridegroom .,1,1,disapproval has property bad disapproval is at location church disapproval is used for make someone feel bad snort desires snort. snort is at location comedy routine. snort is used for make joke.  she snorted her disapproval of the proposed bridegroom .,42
491,critic,,snort, The critic snorted contemptuously .,2,1,critic has property good critic is at location show critic is used for portray something snort desires snort. snort is at location comedy routine. snort is used for make joke.  The critic snorted contemptuously .,37
492,cocaine,,snort, The addict was snorting cocaine almost every day .,3,0,cocaine has property illegal cocaine is at location drug store cocaine is used for pleasure snort desires snort. snort is at location comedy routine. snort is used for make joke.  The addict was snorting cocaine almost every day .,42
493,seed,,sow, She sowed sunflower seeds .,1,0,seed has property green seed is at location seed pod seed is used for seed sow desires flower. sow is at location field. sow is used for produce milk.  She sowed sunflower seeds .,35
494,suspicion,,sow, sow suspicion or beliefs .,0,1,suspicion has property false suspicion is at location church suspicion is used for lie sow desires flower. sow is at location field. sow is used for produce milk.  sow suspicion or beliefs .,33
495,ground,,sow, sow the ground with sunflower seeds .,0,0,ground has property flat ground is at location grind ground is used for stand on sow desires flower. sow is at location field. sow is used for produce milk.  sow the ground with sunflower seeds .,36
496,word,,spell, How do you spell this word ?,3,0,word has property bad word is at location sentence word is used for insult spell desires create. spell is at location spell book. spell is used for make spell.  How do you spell this word ?,39
497,trouble,,spell, I 'm afraid this spells trouble !,4,1,trouble has property bad trouble is at location jail trouble is used for get job spell desires create. spell is at location spell book. spell is used for make spell.  I 'm afraid this spells trouble !,41
498,husband,,spell, She spelled her husband at the wheel .,1,1,husband has property male husband is at location bed husband is used for wife spell desires create. spell is at location spell book. spell is used for make spell.  She spelled her husband at the wheel .,38
499,worker,,spell, the workers spell every four hours .,2,1,worker has property lazy worker is at location work worker is used for work spell desires create. spell is at location spell book. spell is used for make spell.  the workers spell every four hours .,38
500,water,,splash, She splashed the water around her .,1,0,water has property necessary for life water is at location ice cube water is used for wash splash desires swim in ocean. splash is at location waterfall. splash is used for swim.  She splashed the water around her .,40
501,water,,splash, She splashed the water around her .,1,0,water has property necessary for life water is at location ice cube water is used for wash splash desires swim in ocean. splash is at location waterfall. splash is used for swim.  She splashed the water around her .,40
502,mountain,,splash, The mountain was splashed with snow .,3,1,mountain has property very tall mountain is at location mountain mountain is used for climb splash desires swim in ocean. splash is at location waterfall. splash is used for swim.  The mountain was splashed with snow .,40
503,tablecloth,,spot, The wine spotted the tablecloth .,2,0,tablecloth has property white tablecloth is at location table tablecloth is used for cover table spot desires play. spot is at location map. spot is used for hold thing together.  The wine spotted the tablecloth .,38
504,dress,,spot, This dress spots quickly .,2,0,dress has property sexy dress is at location suitcase dress is used for dress spot desires play. spot is at location map. spot is used for hold thing together.  This dress spots quickly .,36
505,area,,spot, spot the areas that one should clearly identify .,0,0,area has property flat area is at location city area is used for store thing spot desires play. spot is at location map. spot is used for hold thing together.  spot the areas that one should clearly identify .,39
506,water,,spray, Water sprayed all over the floor .,1,0,water has property necessary for life water is at location ice cube water is used for wash spray desires spray. spray is at location waterfall. spray is used for spray.  Water sprayed all over the floor .,38
507,water,,spray, spray water on someone .,0,0,water has property necessary for life water is at location ice cube water is used for wash spray desires spray. spray is at location waterfall. spray is used for spray.  spray water on someone .,35
508,wall,,spray, spray the wall with paint .,0,0,wall has property vertical wall is at location wall wall is used for divide room spray desires spray. spray is at location waterfall. spray is used for spray.  spray the wall with paint .,34
509,language,,spread, The invaders spread their language all over the country .,2,1,language has property complex language is at location language language is used for communicate spread desires be satisfy. spread is at location jar. spread is used for make sandwich.  The invaders spread their language all over the country .,41
510,cheese,,spread, spread cheese on a piece of bread .,0,0,cheese has property good cheese is at location store cheese is used for eat spread desires be satisfy. spread is at location jar. spread is used for make sandwich.  spread cheese on a piece of bread .,37
511,infection,,spread, the infection spread .,2,0,infection has property bad infection is at location hospital infection is used for kill bacteria spread desires be satisfy. spread is at location jar. spread is used for make sandwich.  the infection spread .,36
512,oil,,spread, A big oil spot spread across the water .,4,0,oil has property flammable oil is at location kitchen oil is used for make car spread desires be satisfy. spread is at location jar. spread is used for make sandwich.  A big oil spot spread across the water .,43
513,wood,,square, square the wood with a file .,0,0,wood has property hard wood is at location build wood is used for build square desires be open. square is at location geometry. square is used for geometry.  square the wood with a file .,35
514,shoulder,,square, He squared his shoulders .,1,1,shoulder has property short shoulder is at location shoulder shoulder is used for hold thing square desires be open. square is at location geometry. square is used for geometry.  He squared his shoulders .,35
515,idea,,square, one idea squares with the other one .,2,1,idea has property important idea is at location church idea is used for understand square desires be open. square is at location geometry. square is used for geometry.  one idea squares with the other one .,38
516,man,,stagger, The drunken man staggered into the room .,3,0,man has property male man is at location office man is used for love stagger desires rest. stagger is at location street. stagger is used for get somewhere.  The drunken man staggered into the room .,39
517,chair,,stagger, The architect decided to stagger the chairs in the lecture hall .,4,0,chair has property uncomfortable chair is at location in room chair is used for sit on stagger desires rest. stagger is at location street. stagger is used for get somewhere.  The architect decided to stagger the chairs in the lecture hall .,46
518,bill,,stagger, She was staggered with bills after she tried to rebuild her house following the earthquake .,2,1,bill has property due bill is at location mail bill is used for pay bill stagger desires rest. stagger is at location street. stagger is used for get somewhere.  She was staggered with bills after she tried to rebuild her house following the earthquake .,47
519,industry,,stagnate, Industry will stagnate if we do not stimulate our economy .,2,1,industry has property competitive industry is at location city industry is used for make money stagnate desires eat plant. stagnate is at location arctic. stagnate is used for kill person.  Industry will stagnate if we do not stimulate our economy .,43
520,water,,stagnate, There are marshes that stagnate the waters .,4,0,water has property necessary for life water is at location ice cube water is used for wash stagnate desires eat plant. stagnate is at location arctic. stagnate is used for kill person.  There are marshes that stagnate the waters .,44
521,blood,,stagnate, blood stagnates in the capillaries .,1,0,blood has property red blood is at location vein blood is used for kill stagnate desires eat plant. stagnate is at location arctic. stagnate is used for kill person.  blood stagnates in the capillaries .,36
522,name,,stamp, a man whose name is permanently stamped on our maps .,6,1,name has property important name is at location phone book name is used for identify person stamp desires stamp. stamp is at location desk. stamp is used for mail letter.  a man whose name is permanently stamped on our maps .,47
523,letter,,stamp, Are the letters properly stamped ?,4,0,letter has property write on paper letter is at location mail box letter is used for communication stamp desires stamp. stamp is at location desk. stamp is used for mail letter.  Are the letters properly stamped ?,41
524,animal,,stampede, Thunderbolts can stampede animals .,2,0,animal has property curious animal is at location zoo animal is used for eat stampede desires run. stampede is at location parade. stampede is used for escape from fire.  Thunderbolts can stampede animals .,36
525,company,,stampede, Companies will now stampede to release their latest software .,3,1,company has property corrupt company is at location city company is used for make money stampede desires run. stampede is at location parade. stampede is used for escape from fire.  Companies will now stampede to release their latest software .,43
526,ship,,steam, The ship steamed off into the Pacific .,2,0,ship has property noisy ship is at location ocean ship is used for travel steam desires steam. steam is at location steam room. steam is used for steam food.  The ship steamed off into the Pacific .,39
527,indifference,,steam, her indifference to his amorous advances really steamed the young man .,7,1,indifference has property bad indifference is at location church indifference is used for make person feel bad steam desires steam. steam is at location steam room. steam is used for steam food.  her indifference to his amorous advances really steamed the young man .,51
528,vegetable,,steam, just steam the vegetables .,1,0,vegetable has property green vegetable is at location garden vegetable is used for cook steam desires steam. steam is at location steam room. steam is used for steam food.  just steam the vegetables .,35
529,bill,,steamroller, The Senator steamrollered the bill to defeat .,2,1,bill has property due bill is at location mail bill is used for pay bill steamroller desires race. steamroller is at location street. steamroller is used for move fast.  The Senator steamrollered the bill to defeat .,39
530,teacher,,steamroller, The new teacher tends to steamroller .,5,1,teacher has property important teacher is at location classroom teacher is used for teach steamroller desires race. steamroller is at location street. steamroller is used for move fast.  The new teacher tends to steamroller .,40
531,road,,steamroller, steamroller the road .,0,0,road has property confuse road is at location country road is used for drive steamroller desires race. steamroller is at location street. steamroller is used for move fast.  steamroller the road .,32
532,opposition,,steamroller, steamroller the opposition .,0,1,opposition has property bad opposition is at location government opposition is used for change steamroller desires race. steamroller is at location street. steamroller is used for move fast.  steamroller the opposition .,32
533,mane,,stream, their manes streamed like stiff black pennants in the wind .,2,1,mane has property curly mane is at location horse mane is used for keep horse from bite you stream desires swim. stream is at location river. stream is used for swim.  their manes streamed like stiff black pennants in the wind .,44
534,sweat,,stream, She was streaming with sweat .,2,1,sweat has property slippery sweat is at location your finger sweat is used for run stream desires swim. stream is at location river. stream is used for swim.  She was streaming with sweat .,36
535,tear,,stream, Tears streamed down her face .,1,0,tear has property messy tear is at location your eye tear is used for cry stream desires swim. stream is at location river. stream is used for swim.  Tears streamed down her face .,35
536,nose,,stuff, My nose is all stuffed .,4,0,nose has property very sensitive nose is at location face nose is used for smell stuff desires be read. stuff is at location desk. stuff is used for store thing.  My nose is all stuffed .,40
537,dinner,,stuff, She stuffed herself at the dinner .,1,1,dinner has property serve cold dinner is at location table dinner is used for eat stuff desires be read. stuff is at location desk. stuff is used for store thing.  She stuffed herself at the dinner .,38
538,pillow,,stuff, stuff a pillow with feathers .,0,0,pillow has property soft pillow is at location bedroom pillow is used for sleep stuff desires be read. stuff is at location desk. stuff is used for store thing.  stuff a pillow with feathers .,35
539,turkey,,stuff, Have you stuffed the turkey yet ?,2,0,turkey has property delicious turkey is at location supermarket turkey is used for eat stuff desires be read. stuff is at location desk. stuff is used for store thing.  Have you stuffed the turkey yet ?,38
540,poison,,suck, suck the poison from the place where the snake bit .,0,0,poison has property fatal poison is at location laboratory poison is used for kill suck desires eat. suck is at location jar. suck is used for enjoyment.  suck the poison from the place where the snake bit .,38
541,worker,,suck, The current boom in the economy sucked many workers in from abroad .,6,1,worker has property lazy worker is at location work worker is used for work suck desires eat. suck is at location jar. suck is used for enjoyment.  The current boom in the economy sucked many workers in from abroad .,46
542,country,,swallow, The Nazis swallowed the Baltic countries .,2,1,country has property diverse country is at location country country is used for live in swallow desires water. swallow is at location your mouth. swallow is used for swallow.  The Nazis swallowed the Baltic countries .,38
543,wave,,swallow, The huge waves swallowed the small boat and it sank shortly thereafter .,3,1,wave has property very loud wave is at location ocean wave is used for move water swallow desires water. swallow is at location your mouth. swallow is used for swallow.  The huge waves swallowed the small boat and it sank shortly thereafter .,46
544,word,,swallow, She swallowed the last words of her speech .,1,1,word has property bad word is at location sentence word is used for insult swallow desires water. swallow is at location your mouth. swallow is used for swallow.  She swallowed the last words of her speech .,38
545,word,,swallow, He swallowed his words .,1,1,word has property bad word is at location sentence word is used for insult swallow desires water. swallow is at location your mouth. swallow is used for swallow.  He swallowed his words .,34
546,anger,,swallow, I swallowed my anger and kept quiet .,1,1,anger has property bad anger is at location war anger is used for hurt swallow desires water. swallow is at location your mouth. swallow is used for swallow.  I swallowed my anger and kept quiet .,37
547,story,,swallow, Am I supposed to swallow that story ?,4,1,story has property inaccurate story is at location newspaper story is used for entertainment swallow desires water. swallow is at location your mouth. swallow is used for swallow.  Am I supposed to swallow that story ?,40
548,music,,swell, The music swelled to a crescendo .,2,1,music has property fun music is at location radio music is used for entertainment swell desires swim in ocean. swell is at location ocean. swell is used for move air.  The music swelled to a crescendo .,39
549,mother,,swell, The mother was swelling with importance when she spoke of her son .,3,1,mother has property female mother is at location house mother is used for love swell desires swim in ocean. swell is at location ocean. swell is used for move air.  The mother was swelling with importance when she spoke of her son .,46
550,belly,,swell, The bellies of the starving children are swelling .,7,0,belly has property round belly is at location your stomach belly is used for hold food swell desires swim in ocean. swell is at location ocean. swell is used for move air.  The bellies of the starving children are swelling .,48
