,arg1,arg2,verb,sentence,verb_idx,label,new_sentences,new_ind
0,knowledge,,absorb, He absorbed the knowledge or beliefs of his tribe .,1,1,knowledge has property important knowledge is at location school knowledge is used for learn absorb desires be touch. absorb is at location jar. absorb is used for make something.  He absorbed the knowledge or beliefs of his tribe .,40
1,cost,,absorb, He absorbed the costs for the accident .,1,1,cost has property bad cost is at location bank cost is used for buy thing absorb desires be touch. absorb is at location jar. absorb is used for make something.  He absorbed the costs for the accident .,39
2,tax,,absorb, The sales tax is absorbed into the state income tax .,4,1,tax has property bad tax is at location bank tax is used for pay tax absorb desires be touch. absorb is at location jar. absorb is used for make something.  The sales tax is absorbed into the state income tax .,45
3,immigrant,,absorb, The immigrants were quickly absorbed into society .,4,1,immigrant has property ethnic immigrant is at location city immigrant is used for work absorb desires be touch. absorb is at location jar. absorb is used for make something.  The immigrants were quickly absorbed into society .,41
4,interest,,absorb, Her interest in butterflies absorbs her completely .,4,1,interest has property interest interest is at location school interest is used for entertainment absorb desires be touch. absorb is at location jar. absorb is used for make something.  Her interest in butterflies absorbs her completely .,41
5,workers,,abuse, This boss abuses his workers .,2,0,workers has property lazy workers is at location work workers is used for work abuse desires be free. abuse is at location jail. abuse is used for get what you want.  This boss abuses his workers .,39
6,system,,abuse, Do n't abuse the system .,2,1,system has property complex system is at location computer system is used for control abuse desires be free. abuse is at location jail. abuse is used for get what you want.  Do n't abuse the system .,39
7,policeman,,abuse, The actress abused the policeman who gave her a parking ticket .,2,0,policeman has property dangerous policeman is at location roadblock policeman is used for enforce law abuse desires be free. abuse is at location jail. abuse is used for get what you want.  The actress abused the policeman who gave her a parking ticket .,46
8,alcohol,,abuse, Her husband often abuses alcohol .,3,1,alcohol has property bad for you alcohol is at location bar alcohol is used for drink abuse desires be free. abuse is at location jail. abuse is used for get what you want.  Her husband often abuses alcohol .,42
9,guest,,accommodate, This hotel can accommodate 250 guests .,3,0,guest has property entertain guest is at location hotel guest is used for relaxation accommodate desires be satisfy. accommodate is at location church. accommodate is used for accommodate person.  This hotel can accommodate 250 guests .,39
10,result,,accommodate, The scientists had to accommodate the new results with the existing theories .,4,1,result has property bad result is at location math result is used for make something accommodate desires be satisfy. accommodate is at location church. accommodate is used for accommodate person.  The scientists had to accommodate the new results with the existing theories .,47
11,submission,,acknowledge, The program committee acknowledged the submission of the authors of the paper .,3,0,submission has property good submission is at location office submission is used for get what you want acknowledge desires be good. acknowledge is at location church. acknowledge is used for make friend.  The program committee acknowledged the submission of the authors of the paper .,48
12,colleague,,acknowledge, He never acknowledges his colleagues when they run into him in the hallway .,2,0,colleague has property helpful colleague is at location office colleague is used for help acknowledge desires be good. acknowledge is at location church. acknowledge is used for make friend.  He never acknowledges his colleagues when they run into him in the hallway .,45
13,kindness,,acknowledge, We must acknowledge the kindness she showed towards us .,2,0,kindness has property good kindness is at location friend kindness is used for make person feel good acknowledge desires be good. acknowledge is at location church. acknowledge is used for make friend.  We must acknowledge the kindness she showed towards us .,44
14,deed,,acknowledge, acknowledge the deed .,0,0,deed has property important deed is at location bank deed is used for make money acknowledge desires be good. acknowledge is at location church. acknowledge is used for make friend.  acknowledge the deed .,34
15,prince,,acknowledge, The Crown Prince was acknowledged as the true heir to the throne .,4,0,prince has property male prince is at location castle prince is used for play chess acknowledge desires be good. acknowledge is at location church. acknowledge is used for make friend.  The Crown Prince was acknowledged as the true heir to the throne .,47
16,resident,,adhere, The residents of this village adhered to Catholicism .,5,1,resident has property lazy resident is at location apartment resident is used for live in adhere desires clean air. adhere is at location office. adhere is used for keep thing clean.  The residents of this village adhered to Catholicism .,45
17,wallpaper,,adhere, Will this wallpaper adhere to the wall ?,3,0,wallpaper has property white wallpaper is at location wall wallpaper is used for decorate room adhere desires clean air. adhere is at location office. adhere is used for keep thing clean.  Will this wallpaper adhere to the wall ?,42
18,steering,,answer, The steering of my new car answers to the slightest touch .,6,1,steering has property hard steering is at location car steering is used for steer car answer desires answer. answer is at location newspaper. answer is used for get information.  The steering of my new car answers to the slightest touch .,47
19,telephone,,answer, answer the telephone .,0,0,telephone has property old telephone is at location in office telephone is used for call someone answer desires answer. answer is at location newspaper. answer is used for get information.  answer the telephone .,34
20,question,,answer, The question concerning the meaning of life can not be answered .,10,0,question has property important question is at location newspaper question is used for find truth answer desires answer. answer is at location newspaper. answer is used for get information.  The question concerning the meaning of life can not be answered .,51
21,defendant,,answer, The defendant answered to all the charges of the prosecution .,2,0,defendant has property guilty of crime defendant is at location courtroom defendant is used for prosecute crime answer desires answer. answer is at location newspaper. answer is used for get information.  The defendant answered to all the charges of the prosecution .,44
22,mountain,,ascend, We ascended the mountain .,1,0,mountain has property very tall mountain is at location mountain mountain is used for climb ascend desires fly. ascend is at location elevator. ascend is used for go up.  We ascended the mountain .,35
23,inheritance,,ascend, Inheritance may not ascend linearly .,3,1,inheritance has property important inheritance is at location bank inheritance is used for keep person alive ascend desires fly. ascend is at location elevator. ascend is used for go up.  Inheritance may not ascend linearly .,39
24,path,,ascend, The path ascended to the top of the hill .,2,0,path has property uphill path is at location forest path is used for go somewhere ascend desires fly. ascend is at location elevator. ascend is used for go up.  The path ascended to the top of the hill .,41
25,poland,,attack," Hitler attacked Poland on September 1 , 1939 and started World War II .",1,0,"poland has property south of europe poland is at location in europe poland is used for invade poland attack desires win war. attack is at location war. attack is used for intimidate.  Hitler attacked Poland on September 1 , 1939 and started World War II .",47
26,speaker,,attack, The editors of the left - leaning paper attacked the new House Speaker .,8,1,speaker has property loud speaker is at location office speaker is used for make sound attack desires win war. attack is at location war. attack is used for intimidate.  The editors of the left - leaning paper attacked the new House Speaker .,51
27,village,,attack, The Serbs attacked the village at night .,2,0,village has property fun village is at location country village is used for live in attack desires win war. attack is at location war. attack is used for intimidate.  The Serbs attacked the village at night .,39
28,problem,,attack, I attacked the problem as soon as I got out of bed .,1,1,problem has property bad problem is at location office problem is used for solve attack desires win war. attack is at location war. attack is used for intimidate.  I attacked the problem as soon as I got out of bed .,42
29,cancer,,attack, The cancer cells are attacking his liver .,4,1,cancer has property bad cancer is at location hospital cancer is used for kill attack desires win war. attack is at location war. attack is used for intimidate.  The cancer cells are attacking his liver .,40
30,vienna,,besiege, The Turks besieged Vienna .,2,0,vienna has property famous for it chocolate vienna is at location austria vienna is used for vienna besiege desires kill person. besiege is at location war. besiege is used for kill person.  The Turks besieged Vienna .,39
31,problem,,besiege, She was besieged by so many problems that she got discouraged .,2,1,problem has property bad problem is at location office problem is used for solve besiege desires kill person. besiege is at location war. besiege is used for kill person.  She was besieged by so many problems that she got discouraged .,43
32,press,,besiege, The press photographers besieged the movie star .,3,1,press has property important press is at location television press is used for transmit information besiege desires kill person. besiege is at location war. besiege is used for kill person.  The press photographers besieged the movie star .,41
33,foot,,bind, The Chinese would bind the feet of their women .,3,0,foot has property long foot is at location shoe foot is used for walk bind desires bind. bind is at location hospital. bind is used for bind.  The Chinese would bind the feet of their women .,40
34,book,,bind, They bind their books in leather .,1,0,book has property heavy book is at location library book is used for learn bind desires bind. bind is at location hospital. bind is used for bind.  They bind their books in leather .,35
35,oxygen,,bind, The hydrogen binds the oxygen .,2,1,oxygen has property essential to life oxygen is at location air oxygen is used for life bind desires bind. bind is at location hospital. bind is used for bind.  The hydrogen binds the oxygen .,37
36,meteor,,blaze, Meteors blazed across the atmosphere .,1,1,meteor has property very large meteor is at location space meteor is used for travel between solar system blaze desires burn. blaze is at location fire. blaze is used for burn.  Meteors blazed across the atmosphere .,38
37,pine,,blaze, The summer sun alone can cause a pine to blaze .,9,0,pine has property green pine is at location forest pine is used for make campfire blaze desires burn. blaze is at location fire. blaze is used for burn.  The summer sun alone can cause a pine to blaze .,48
38,spaceship,,blaze, The spaceship blazed out into space .,2,1,spaceship has property fast spaceship is at location space spaceship is used for travel blaze desires burn. blaze is at location fire. blaze is used for burn.  The spaceship blazed out into space .,36
39,foot,,blister, Her feet blistered during the long hike .,2,0,foot has property long foot is at location shoe foot is used for walk blister desires burn. blister is at location finger. blister is used for burn.  Her feet blistered during the long hike .,37
40,administration,,blister, The Senator blistered the administration in his speech on Friday .,2,1,administration has property important administration is at location school administration is used for organize information blister desires burn. blister is at location finger. blister is used for burn.  The Senator blistered the administration in his speech on Friday .,41
41,haze,,blur, The haze blurs the hills .,2,0,haze has property cool haze is at location thunderstorm haze is used for clear vision blur desires play. blur is at location movie. blur is used for correct mistake.  The haze blurs the hills .,37
42,vision,,blur, The fog blurs my vision .,2,0,vision has property very important vision is at location book vision is used for see blur desires play. blur is at location movie. blur is used for correct mistake.  The fog blurs my vision .,37
43,distinction,,blur, The distinction between the two theories blurred .,6,1,distinction has property bad distinction is at location church distinction is used for make person feel good blur desires play. blur is at location movie. blur is used for correct mistake.  The distinction between the two theories blurred .,45
44,listener,,bolt, The listeners bolted when he discussed his strange ideas .,2,1,listener has property important listener is at location conference listener is used for listen bolt desires be clean. bolt is at location garage. bolt is used for fasten thing together.  The listeners bolted when he discussed his strange ideas .,42
45,food,,bolt, Do n't bolt your food !,2,1,food has property good food is at location pantry food is used for nutrition bolt desires be clean. bolt is at location garage. bolt is used for fasten thing together.  Do n't bolt your food !,38
46,economy,,boost, The tax cut will boost the economy .,4,1,economy has property bad economy is at location city economy is used for buy thing boost desires win. boost is at location bridge. boost is used for lift something.  The tax cut will boost the economy .,41
47,voltage,,boost, Boost the voltage in an electrical circuit .,0,0,voltage has property dangerous voltage is at location electrical circuit voltage is used for electricity boost desires win. boost is at location bridge. boost is used for lift something.  Boost the voltage in an electrical circuit .,37
48,singer,,boost, The singer had to be boosted onto the stage by a special contraption .,5,0,singer has property sing singer is at location opera singer is used for sing boost desires win. boost is at location bridge. boost is used for lift something.  The singer had to be boosted onto the stage by a special contraption .,47
49,ball,,bounce, The rubber ball bounced .,3,0,ball has property round ball is at location toy store ball is used for play basketball bounce desires win. bounce is at location park. bounce is used for exercise.  The rubber ball bounced .,37
50,people,,bounce, The ex - boxer 's job is to bounce people who want to enter this private club .,8,1,people has property selfish people is at location bus stop people is used for work bounce desires win. bounce is at location park. bounce is used for exercise.  The ex - boxer 's job is to bounce people who want to enter this private club .,54
51,government,,bow, The government bowed to the military pressure .,2,1,government has property corrupt government is at location democracy government is used for control bow desires be gift. bow is at location boat. bow is used for tie bow.  The government bowed to the military pressure .,39
52,life,,breathe, He breathed new life into the old house .,1,1,life has property fragile life is at location earth life is used for live breathe desires live. breathe is at location hospital. breathe is used for live.  He breathed new life into the old house .,37
53,fabric,,breathe, Our new synthetic fabric breathes and is perfect for summer wear .,4,1,fabric has property weave fabric is at location sew room fabric is used for make curtain breathe desires live. breathe is at location hospital. breathe is used for live.  Our new synthetic fabric breathes and is perfect for summer wear .,45
54,hair,,brush, Johnson brushed the hairs from his jacket .,1,0,hair has property curly hair is at location your head hair is used for wash brush desires brush tooth. brush is at location bathroom. brush is used for clean your hair.  Johnson brushed the hairs from his jacket .,40
55,wall,,brush, He brushed the wall lightly .,1,0,wall has property vertical wall is at location wall wall is used for divide room brush desires brush tooth. brush is at location bathroom. brush is used for clean your hair.  He brushed the wall lightly .,38
56,suit,,brush, She brushed the suit before hanging it back into the closet .,1,0,suit has property expensive suit is at location suitcase suit is used for protect your body brush desires brush tooth. brush is at location bathroom. brush is used for clean your hair.  She brushed the suit before hanging it back into the closet .,45
57,suspense,,build, Suspense was building right from the beginning of the opera .,2,1,suspense has property excite suspense is at location theatre suspense is used for make person nervous build desires build. build is at location build. build is used for shelter.  Suspense was building right from the beginning of the opera .,42
58,school,,build, The government is building new schools in this state .,3,0,school has property fun school is at location town school is used for teach build desires build. build is at location build. build is used for shelter.  The government is building new schools in this state .,40
59,nation,,build, build a modern nation .,0,1,nation has property corrupt nation is at location world nation is used for govern build desires build. build is at location build. build is used for shelter.  build a modern nation .,32
60,architect,,build, These architects build in interesting and new styles .,2,0,architect has property old architect is at location build architect is used for build build desires build. build is at location build. build is used for shelter.  These architects build in interesting and new styles .,38
61,defense,,build, build a defense on nothing but the accused person 's reputation .,0,1,defense has property important defense is at location school defense is used for protect someone build desires build. build is at location build. build is used for shelter.  build a defense on nothing but the accused person 's reputation .,40
62,sum,,buy, This sum will buy you a ride on the train .,3,0,sum has property plural sum is at location sum sum is used for sum buy desires buy thing. buy is at location supermarket. buy is used for buy thing.  This sum will buy you a ride on the train .,43
63,love,,buy, She wanted to buy his love with her dedication to him and his work .,3,0,love has property good love is at location family love is used for give buy desires buy thing. buy is at location supermarket. buy is used for buy thing.  She wanted to buy his love with her dedication to him and his work .,47
64,story,,buy, I ca n't buy this story .,3,1,story has property inaccurate story is at location newspaper story is used for entertainment buy desires buy thing. buy is at location supermarket. buy is used for buy thing.  I ca n't buy this story .,39
65,bee,,buzz, bees were buzzing around the hive .,2,0,bee has property small bee is at location flower bee is used for fly buzz desires play game. buzz is at location stadium. buzz is used for fun.  bees were buzzing around the hive .,37
66,plane,,buzz, Planes buzzed the crowds in the square .,1,0,plane has property fly plane is at location airport plane is used for fly buzz desires play game. buzz is at location stadium. buzz is used for fun.  Planes buzzed the crowds in the square .,37
67,office,,buzz, This office is buzzing with activity .,3,1,office has property clutter office is at location office build office is used for work buzz desires play game. buzz is at location stadium. buzz is used for fun.  This office is buzzing with activity .,39
68,servant,,buzz, he buzzed the servant .,1,1,servant has property courteous servant is at location mansion servant is used for serve buzz desires play game. buzz is at location stadium. buzz is used for fun.  he buzzed the servant .,34
69,essence,,capture, capture the essence of Spring   .,0,1,essence has property important essence is at location water essence is used for make something capture desires get money. capture is at location circus. capture is used for punish criminal.  capture the essence of Spring   .,36
70,heart,,capture, She captured all the men 's hearts .,1,1,heart has property strong heart is at location person heart is used for love capture desires get money. capture is at location circus. capture is used for punish criminal.  She captured all the men 's hearts .,38
71,neutron,,capture, This nucleus has captured the slow - moving neutrons .,3,0,neutron has property very small neutron is at location space neutron is used for neutralise energy capture desires get money. capture is at location circus. capture is used for punish criminal.  This nucleus has captured the slow - moving neutrons .,44
72,way,,claw, They clawed their way to the top of the mountain .,1,1,way has property move way is at location universe way is used for get something claw desires eat. claw is at location your arm. claw is used for scratch.  They clawed their way to the top of the mountain .,41
73,doorknob,,claw, She clawed the doorknob .,1,1,doorknob has property open doorknob is at location front door doorknob is used for open door claw desires eat. claw is at location your arm. claw is used for scratch.  She clawed the doorknob .,36
74,rival,,claw, The politician clawed his rival .,2,1,rival has property bad rival is at location war rival is used for make enemy claw desires eat. claw is at location your arm. claw is used for scratch.  The politician clawed his rival .,37
75,hill,,climb, Did you ever climb up the hill behind your house ?,3,0,hill has property flat hill is at location countryside hill is used for climb climb desires climb mountain. climb is at location mountain. climb is used for get up mountain.  Did you ever climb up the hill behind your house ?,44
76,sale,,climb, Sales were climbing after prices were lowered .,2,1,sale has property expensive sale is at location shop sale is used for sell product climb desires climb mountain. climb is at location mountain. climb is used for get up mountain.  Sales were climbing after prices were lowered .,41
77,price,,climb, Sales were climbing after prices were lowered .,2,1,price has property bad price is at location bank price is used for buy thing climb desires climb mountain. climb is at location mountain. climb is used for get up mountain.  Sales were climbing after prices were lowered .,41
78,path,,climb, The path climbed all the way to the top of the hill .,2,1,path has property uphill path is at location forest path is used for go somewhere climb desires climb mountain. climb is at location mountain. climb is used for get up mountain.  The path climbed all the way to the top of the hill .,46
79,drain,,clog, The leaves clog our drains in the Fall .,2,0,drain has property slippery drain is at location drain drain is used for drain clog desires water. clog is at location drain. clog is used for drain.  The leaves clog our drains in the Fall .,38
80,horse,,clog, horses were clogged until they were tamed .,2,1,horse has property big horse is at location kentucky derby horse is used for ride clog desires water. clog is at location drain. clog is used for drain.  horses were clogged until they were tamed .,38
81,market,,clog, The market is being clogged by these operations .,4,1,market has property very popular market is at location city market is used for buy thing clog desires water. clog is at location drain. clog is used for drain.  The market is being clogged by these operations .,42
82,mind,,clog, Fear clogged her mind .,1,1,mind has property good mind is at location your head mind is used for think clog desires water. clog is at location drain. clog is used for drain.  Fear clogged her mind .,34
83,smoke,,cloud, The smoke clouded above the houses .,2,0,smoke has property bad for your health smoke is at location fire smoke is used for kill bacteria cloud desires be extinguish. cloud is at location sky. cloud is used for make rain fall.  The smoke clouded above the houses .,43
84,face,,cloud, Their faces were clouded with sadness .,3,1,face has property round face is at location face face is used for look at thing cloud desires be extinguish. cloud is at location sky. cloud is used for make rain fall.  Their faces were clouded with sadness .,42
85,memory,,cloud, The stroke clouded memories of her youth .,2,1,memory has property important memory is at location computer memory is used for remember cloud desires be extinguish. cloud is at location sky. cloud is used for make rain fall.  The stroke clouded memories of her youth .,40
86,liquid,,cloud, The chemical clouded the liquid to which it was added .,2,1,liquid has property liquid liquid is at location container liquid is used for drink cloud desires be extinguish. cloud is at location sky. cloud is used for make rain fall.  The chemical clouded the liquid to which it was added .,43
87,idea,,color, His political ideas color his lectures .,3,1,idea has property important idea is at location church idea is used for understand color desires be mix. color is at location rainbow. color is used for make picture.  His political ideas color his lectures .,39
