,arg1,arg2,verb,sentence,verb_idx,label,new_sentences,new_ind
143,tank,,drain, We drained the oil tank .,1,0,tank desiresracetank is capable oftravel on roadtank has propertyheavytank is at locationwartank is used forkill persontank is made ofmetaldrain desiresfill with waterdrain is capable ofbe draindrain has propertyslipperydrain is at locationdraindrain is used fordrain,268
144,life,,drain, Life in the camp drained him .,4,1,life desireslivelife is capable ofbe good thinglife has propertyfragilelife is at locationearthlife is used forlivelife is made oflifedrain desiresfill with waterdrain is capable ofbe draindrain has propertyslipperydrain is at locationdraindrain is used fordrain,266
145,snow,,drift, snow drifting several feet high .,1,0,snow desiressnowsnow is capable offall from skysnow has propertywhitesnow is at locationantarcticasnow is used formake snowmansnow is made oficedrift desiresswimdrift is capable ofbe part of naturedrift has propertyrelaxdrift is at locationoceandrift is used forswim,267
146,price,,drift, stock prices are drifting higher .,3,1,price desiresgood serviceprice is capable ofincrease your profitprice has propertybadprice is at locationbankprice is used forbuy thingprice is made ofdollardrift desiresswimdrift is capable ofbe part of naturedrift has propertyrelaxdrift is at locationoceandrift is used forswim,282
147,son,,drift, My son drifted around for years in California before going to law school .,2,1,son desiresplay with toyson is capable ofbe boyson has propertymaleson is at locationfamilyson is used forplay withson is made ofmaledrift desiresswimdrift is capable ofbe part of naturedrift has propertyrelaxdrift is at locationoceandrift is used forswim,257
148,man,,drift, The unknown young man drifted among the invited guests .,4,1,man desiresbe goodman is capable ofbe goodman has propertymaleman is at locationofficeman is used forloveman is made ofmuscledrift desiresswimdrift is capable ofbe part of naturedrift has propertyrelaxdrift is at locationoceandrift is used forswim,251
149,boat,,drift, drift the boats downstream .,0,0,boat desiressailboat is capable oftravel on waterboat has propertyfunboat is at locationwaterboat is used fortravelboat is made ofwooddrift desiresswimdrift is capable ofbe part of naturedrift has propertyrelaxdrift is at locationoceandrift is used forswim,256
150,market,,drift, The stock market drifted upward .,3,1,market desiresgood productmarket is capable ofsell productmarket has propertyvery popularmarket is at locationcitymarket is used forbuy thingmarket is made ofpersondrift desiresswimdrift is capable ofbe part of naturedrift has propertyrelaxdrift is at locationoceandrift is used forswim,289
151,liter,,drink, The patient must drink several liters each day .,3,0,liter desireswaterliter is capable ofbe heavy than containerliter has propertyheavyliter is at locationcontainerliter is used forcarry thingliter is made offlourdrink desiresbe drunkdrink is capable ofcause deathdrink has propertygooddrink is at locationbardrink is used forquench your thirst,295
152,word,,drink, The mother drinks in every word of her son on the stage .,2,1,word desiresbe writeword is capable ofmean somethingword has propertybadword is at locationsentenceword is used forinsultword is made ofsounddrink desiresbe drunkdrink is capable ofcause deathdrink has propertygooddrink is at locationbardrink is used forquench your thirst,274
153,husband,,drink, The husband drinks and beats his wife .,2,0,husband desiresbe marry to womanhusband is capable ofmarry wifehusband has propertymalehusband is at locationbedhusband is used forwifehusband is made ofmaledrink desiresbe drunkdrink is capable ofcause deathdrink has propertygooddrink is at locationbardrink is used forquench your thirst,290
154,trouble,,drown, She drowned her trouble in alcohol .,1,1,trouble desireswintrouble is capable ofbe bad thingtrouble has propertybadtrouble is at locationjailtrouble is used forget jobtrouble is made ofconsequencedrown desiresdrowndrown is capable ofdrowndrown has propertypainfuldrown is at locationseadrown is used fordrown,268
155,child,,drown, The child drowned in the lake .,2,0,child desiresplaychild is capable ofplay with toychild has propertyvery creativechild is at locationkindergartenchild is used forplay withchild is made ofclaydrown desiresdrowndrown is capable ofdrowndrown has propertypainfuldrown is at locationseadrown is used fordrown,272
156,surface,,dull, Age had dulled the surface .,2,0,surface desiresswimsurface is capable ofbe different shapesurface has propertyflatsurface is at locationoceansurface is used forhold thing togethersurface is made ofsanddull desiresbe extinguishdull is capable ofmean changedull has propertybad for your eyedull is at locationrefrigeratordull is used forpaint,310
157,appetite,,dull, Middle age dulled her appetite for travel .,2,1,appetite desireseatappetite is capable ofbe poisonappetite has propertygoodappetite is at locationrestaurantappetite is used forsatisfy hungerappetite is made ofmeatdull desiresbe extinguishdull is capable ofmean changedull has propertybad for your eyedull is at locationrefrigeratordull is used forpaint,306
158,garbage,,dump, The truck dumped the garbage in the street .,2,0,garbage desireswastegarbage is capable ofbe trashgarbage has propertybadgarbage is at locationtrashgarbage is used forrecyclegarbage is made ofsoildump desireswaterdump is capable ofbe gooddump has propertybaddump is at locationdraindump is used forrecycle,258
159,proprietor,,emerge," Suddenly , the proprietor emerged from his office .",4,0,proprietor desiresgood serviceproprietor is capable ofsell goodproprietor has propertyoldproprietor is at locationbarproprietor is used forsell goodproprietor is made ofdressemerge desiresfreedomemerge is capable ofbe many different coloremerge has propertydarkemerge is at locationsubwayemerge is used forget through,321
160,result,,emerge, Some nice results emerged from the study .,3,1,result desireswinresult is capable ofbe measure in scaleresult has propertybadresult is at locationmathresult is used formake somethingresult is made ofnumberemerge desiresfreedomemerge is capable ofbe many different coloremerge has propertydarkemerge is at locationsubwayemerge is used forget through,304
161,event,,engrave, The event engraved itself into her memory .,2,1,event desiresbe freeevent is capable ofhappenevent has propertyimportantevent is at locationdisneylandevent is used foreventevent is made ofeventengrave desiresbe forgiveengrave is capable ofbe graveengrave has propertyevilengrave is at locationgraveengrave is used forbury dead body,285
162,pen,,engrave, engrave the pen with the owner 's name .,0,0,pen desiresbe writepen is capable ofbe dangerouspen has propertyblackpen is at locationdeskpen is used forwritepen is made ofpaperengrave desiresbe forgiveengrave is capable ofbe graveengrave has propertyevilengrave is at locationgraveengrave is used forbury dead body,268
163,formula,,erase, Please erase the formula on the blackboard -- it is wrong !,1,0,formula desiresbe reproduceformula is capable ofbe fixformula has propertycomplexformula is at locationlaboratoryformula is used fordetermine valueformula is made ofcomponenterase desireswriteerase is capable oferaseerase has propertyharderase is at locationdeskerase is used forerase,285
164,disk,,erase, Who erased the files form my hard disk ?,1,0,disk desiresbe usedisk is capable ofstore informationdisk has propertyrounddisk is at locationcomputerdisk is used forstore datadisk is made ofsiliconerase desireswriteerase is capable oferaseerase has propertyharderase is at locationdeskerase is used forerase,261
165,unrest,,erupt, Unrest erupted in the country .,1,1,unrest desireswarunrest is capable ofhappen anytimeunrest has propertybadunrest is at locationcityunrest is used formake warunrest is made ofunresterupt desiresburnerupt is capable ofcause fireerupt has propertyscaryerupt is at locationwarerupt is used foranger,262
166,tooth,,erupt, The tooth erupted and had to be extracted .,2,1,tooth desireseattooth is capable ofdecaytooth has propertypointytooth is at locationyour mouthtooth is used forchewtooth is made ofmetalerupt desiresburnerupt is capable ofcause fireerupt has propertyscaryerupt is at locationwarerupt is used foranger,252
167,rash,,erupt, A rash erupted on her arms after she had touched the exotic plant .,2,1,rash desiresitchrash is capable ofcause rashrash has propertyitchyrash is at locationyour fingerrash is used forstingrash is made ofbacteriaerupt desiresburnerupt is capable ofcause fireerupt has propertyscaryerupt is at locationwarerupt is used foranger,256
168,bomb,,explode, We exploded the nuclear bomb .,1,0,bomb desiresdestroybomb is capable ofdestroy housebomb has propertydangerousbomb is at locationbomber planebomb is used forkill personbomb is made ofmetalexplode desiresexplodeexplode is capable ofcause damageexplode has propertyloudexplode is at locationspaceexplode is used fordestroy thing,293
169,bottle,,explode, The champagne bottle exploded .,3,0,bottle desiresbe light than airbottle is capable ofhold liquidbottle has propertyemptybottle is at locationkitchenbottle is used forhold liquidbottle is made ofwaterexplode desiresexplodeexplode is capable ofcause damageexplode has propertyloudexplode is at locationspaceexplode is used fordestroy thing,306
170,boss,,explode, The boss exploded when he heard of the resignation of the secretary .,2,1,boss desiresanswer to his questionboss is capable offire employeeboss has propertyimportantboss is at locationofficeboss is used forworkboss is made ofpersonexplode desiresexplodeexplode is capable ofcause damageexplode has propertyloudexplode is at locationspaceexplode is used fordestroy thing,297
171,bridge,,explode, The enemy exploded the bridge .,2,0,bridge desiresflybridge is capable ofcross waterbridge has propertyvery tallbridge is at locationriverbridge is used forcross waterbridge is made ofstoneexplode desiresexplodeexplode is capable ofcause damageexplode has propertyloudexplode is at locationspaceexplode is used fordestroy thing,293
172,lock,,fasten, He fastened the lock onto the door .,1,0,lock desiresopenlock is capable ofkeep person outlock has propertyhard to picklock is at locationgaragelock is used forkeep person outlock is made ofmetalfasten desiresflyfasten is capable offasten your seat beltfasten has propertytightfasten is at locationairplanefasten is used forfasten coat,295
173,dress,,fasten, This dress fastens in the back .,2,0,dress desiresbe washdress is capable ofbe dressdress has propertysexydress is at locationsuitcasedress is used fordressdress is made ofsilkfasten desiresflyfasten is capable offasten your seat beltfasten has propertytightfasten is at locationairplanefasten is used forfasten coat,281
174,nickname,,fasten, They fastened various nicknames to each other .,1,1,nickname desiresbe writenickname is capable ofmean somethingnickname has propertyfunnynickname is at locationdictionarynickname is used forinsultnickname is made ofwordfasten desiresflyfasten is capable offasten your seat beltfasten has propertytightfasten is at locationairplanefasten is used forfasten coat,309
175,grape,,ferment, We ferment the grapes for a very long time to achieve high alcohol content .,1,0,grape desiresfruitgrape is capable ofbe grapegrape has propertygreengrape is at locationmarketgrape is used foreatgrape is made ofgrapeferment desiresfoodferment is capable ofcause cancerferment has propertygoodferment is at locationstewferment is used formake wine,266
176,child,,fill, fill the child with pride .,0,1,child desiresplaychild is capable ofplay with toychild has propertyvery creativechild is at locationkindergartenchild is used forplay withchild is made ofclayfill desiresfoodfill is capable offill bucketfill has propertygoodfill is at locationjarfill is used forfill empty,272
177,pool,,fill, The pool slowly filled with water .,3,0,pool desirespool tablepool is capable ofbe very dangerous gamepool has propertyfunpool is at locationbackyardpool is used forswim inpool is made ofwaterfill desiresfoodfill is capable offill bucketfill has propertygoodfill is at locationjarfill is used forfill empty,269
178,container,,fill, The liquid fills the container .,2,0,container desiresbe recyclablecontainer is capable ofhold liquidcontainer has propertyheavycontainer is at locationkitchencontainer is used forhold thingcontainer is made ofplasticfill desiresfoodfill is capable offill bucketfill has propertygoodfill is at locationjarfill is used forfill empty,296
179,wing,,flap, The bird flapped its wings .,2,0,wing desiresflywing is capable offlapwing has propertyvery usefulwing is at locationairplanewing is used forliftwing is made ofmetalflap desiresflapflap is capable offlapflap has propertyopenflap is at locationwindowflap is used foropen flap,243
180,star,,flare, Every star seemed to flare with new intensity .,4,1,star desiresflystar is capable ofappear to be in orbitstar has propertybigstar is at locationouterspacestar is used fortravel between solar systemstar is made ofhydrogen and heliumflare desiresburnflare is capable ofkill personflare has propertydangerousflare is at locationelectrical circuitflare is used forlight cigarette,328
181,light,,flash, The lights were flashing .,3,0,light desireslightlight is capable ofburnlight has propertybrightlight is at locationin roomlight is used forilluminatelight is made ofelectronflash desiresplay gameflash is capable ofhurt eyeflash has propertybrightflash is at locationtelevisionflash is used forshow off,274
182,intelligence,,flash, The latest intelligence is flashed to all command posts .,4,1,intelligence desiresbe freeintelligence is capable ofbe use to spyintelligence has propertyusefulintelligence is at locationcomputerintelligence is used formanipulateintelligence is made ofintelligenceflash desiresplay gameflash is capable ofhurt eyeflash has propertybrightflash is at locationtelevisionflash is used forshow off,333
183,bill,,flash, he flashed a $ 100 bill .,1,1,bill desiresmoneybill is capable ofpay billbill has propertyduebill is at locationmailbill is used forpay billbill is made ofpaperflash desiresplay gameflash is capable ofhurt eyeflash has propertybrightflash is at locationtelevisionflash is used forshow off,259
184,star,,flash, A shooting star flashed and was gone .,3,0,star desiresflystar is capable ofappear to be in orbitstar has propertybigstar is at locationouterspacestar is used fortravel between solar systemstar is made ofhydrogen and heliumflash desiresplay gameflash is capable ofhurt eyeflash has propertybrightflash is at locationtelevisionflash is used forshow off,311
185,log,,float, He floated the logs down the river .,1,0,log desiresfuellog is capable ofbe movelog has propertyfunlog is at locationforestlog is used forbuild campfirelog is made ofwoodfloat desiresfloat on waterfloat is capable offloat on waterfloat has propertyfunfloat is at locationwaterfloat is used forexercise,261
186,idea,,float, The Republicans are floating the idea of a tax reform .,3,1,idea desiresbe understandidea is capable ofbe abstractidea has propertyimportantidea is at locationchurchidea is used forunderstandidea is made ofideafloat desiresfloat on waterfloat is capable offloat on waterfloat has propertyfunfloat is at locationwaterfloat is used forexercise,284
187,dancer,,float, The dancer floated across the stage .,2,1,dancer desiresdancedancer is capable ofdancedancer has propertysexydancer is at locationdance clubdancer is used fordancedancer is made ofdancerfloat desiresfloat on waterfloat is capable offloat on waterfloat has propertyfunfloat is at locationwaterfloat is used forexercise,277
188,ruble,,float, The government floated the ruble for a few months .,2,1,ruble desiresplayruble is capable ofbe smallruble has propertyheavyruble is at locationjarruble is used formake noiseruble is made ofmetalfloat desiresfloat on waterfloat is capable offloat on waterfloat has propertyfunfloat is at locationwaterfloat is used forexercise,271
189,village,,flood, The swollen river flooded the village .,3,0,village desiresplay gamevillage is capable ofbe very largevillage has propertyfunvillage is at locationcountryvillage is used forlive invillage is made ofpersonflood desiresextinguish fireflood is capable ofdestroy buildflood has propertyvery dangerousflood is at locationflood areaflood is used forflood,307
190,market,,flood, flood the market with tennis shoes .,0,1,market desiresgood productmarket is capable ofsell productmarket has propertyvery popularmarket is at locationcitymarket is used forbuy thingmarket is made ofpersonflood desiresextinguish fireflood is capable ofdestroy buildflood has propertyvery dangerousflood is at locationflood areaflood is used forflood,308
191,basement,,flood, Our basement flooded during the heavy rains .,2,0,basement desiresbasementbasement is capable ofbe different sizebasement has propertydarkbasement is at locationbuildbasement is used forstore thingbasement is made ofconcreteflood desiresextinguish fireflood is capable ofdestroy buildflood has propertyvery dangerousflood is at locationflood areaflood is used forflood,320
192,crowd,,flow, The crowd flowed out of the stadium .,2,1,crowd desiresplay sportcrowd is capable ofcheer for their herocrowd has propertynoisycrowd is at locationstadiumcrowd is used forwatch sportcrowd is made ofpersonflow desiresflowflow is capable offlowflow has propertynecessary to moveflow is at locationriverflow is used formove thing,286
193,water,,flow, Water flowed into the cave .,1,0,water desiresdrinkwater is capable offlow downhillwater has propertynecessary for lifewater is at locationice cubewater is used forwashwater is made ofwaterflow desiresflowflow is capable offlowflow has propertynecessary to moveflow is at locationriverflow is used formove thing,279
194,champagne,,flow, The champagne flowed at the wedding .,2,1,champagne desiresserve at ballchampagne is capable ofbe romantic drinkchampagne has propertybubblychampagne is at locationbarchampagne is used forcelebratechampagne is made offlowerflow desiresflowflow is capable offlowflow has propertynecessary to moveflow is at locationriverflow is used formove thing,305
195,garbage,,flush, The garbage flushed down the river .,2,0,garbage desireswastegarbage is capable ofbe trashgarbage has propertybadgarbage is at locationtrashgarbage is used forrecyclegarbage is made ofsoilflush desiresmasturbateflush is capable ofmean heatflush has propertyredflush is at locationtoiletflush is used forhide,268
196,sky,,flush, the sky flushed with rosy splendor .,2,1,sky desiresflysky is capable ofbe different colorsky has propertyblack at nightsky is at locationskysky is used forflysky is made ofcloudflush desiresmasturbateflush is capable ofmean heatflush has propertyredflush is at locationtoiletflush is used forhide,258
197,wound,,flush, flush the wound with antibiotics .,0,1,wound desiresburnwound is capable ofhurtwound has propertypainfulwound is at locationwarwound is used forstop bleedwound is made ofmetalflush desiresmasturbateflush is capable ofmean heatflush has propertyredflush is at locationtoiletflush is used forhide,255
198,character,,form, form the young child 's character .,0,1,character desiresbe goodcharacter is capable ofbe playcharacter has propertyfuncharacter is at locationplay in playcharacter is used forentertainmentcharacter is made ofideaform desiresbe freeform is capable ofbe many different colorform has propertyimportantform is at locationbookform is used formake thing,308
199,water,,form, the water formed little beads .,2,0,water desiresdrinkwater is capable offlow downhillwater has propertynecessary for lifewater is at locationice cubewater is used forwashwater is made ofwaterform desiresbe freeform is capable ofbe many different colorform has propertyimportantform is at locationbookform is used formake thing,293
200,language,,fracture, This writer really fractures the language .,3,1,language desirescommunicatelanguage is capable ofbe readlanguage has propertycomplexlanguage is at locationlanguagelanguage is used forcommunicatelanguage is made oflanguagefracture desiresbreakfracture is capable ofcause injuryfracture has propertybadfracture is at locationarteryfracture is used forbreak bone,314
201,balance,,fracture, These events could fracture the balance of power .,3,1,balance desiresbe freebalance is capable ofequal weightbalance has propertyimportantbalance is at locationdeskbalance is used forweigh itembalance is made ofatomfracture desiresbreakfracture is capable ofcause injuryfracture has propertybadfracture is at locationarteryfracture is used forbreak bone,302
202,bolt,,fracture, The pothole fractured a bolt on the axle .,2,0,bolt desiresbe cleanbolt is capable ofopen boltbolt has propertyhardbolt is at locationgaragebolt is used forfasten thing togetherbolt is made ofmetalfracture desiresbreakfracture is capable ofcause injuryfracture has propertybadfracture is at locationarteryfracture is used forbreak bone,290
203,car,,fuel," fuel aircraft , ships , and cars .",0,0,car desiresrun on gasolinecar is capable ofbe dangerouscar has propertydangerouscar is at locationin garagecar is used fortravelcar is made ofmetalfuel desiresfuelfuel is capable ofpower carfuel has propertyessential to lifefuel is at locationplanefuel is used fortravel,270
204,tanker,,fuel, The tanker fueled in Bahrain .,2,0,tanker desiresfueltanker is capable oflandtanker has propertyvery noisytanker is at locationairporttanker is used forship cargotanker is made ofmetalfuel desiresfuelfuel is capable ofpower carfuel has propertyessential to lifefuel is at locationplanefuel is used fortravel,274
205,debate,,fuel, fuel the debate on creationism .,0,1,debate desiresdebatedebate is capable ofbe debatedebate has propertyimportantdebate is at locationdebatedebate is used fordebatedebate is made ofopinionfuel desiresfuelfuel is capable ofpower carfuel has propertyessential to lifefuel is at locationplanefuel is used fortravel,275
206,press,,gag, The press was gagged .,3,1,press desiresanswer to questionpress is capable ofbe presspress has propertyimportantpress is at locationtelevisionpress is used fortransmit informationpress is made ofpapergag desiresgaggag is capable ofcause gaggag has propertyunpleasantgag is at locationgaggag is used forgag,281
207,horse,,gallop, The horse was galloping along .,3,0,horse desiresrunhorse is capable ofjump over obstaclehorse has propertybighorse is at locationkentucky derbyhorse is used forridehorse is made ofmusclegallop desiresrungallop is capable ofbe fun sportgallop has propertyfungallop is at locationhorsegallop is used forride horse,279
208,girl,,glare, The girl glared at the man who tried to make a pass at her .,2,0,girl desiresplay with ballgirl is capable ofbe girlgirl has propertycutegirl is at locationschoolgirl is used forlovegirl is made ofgirlglare desiresbe readglare is capable ofanger animalglare has propertydangerousglare is at locationpersonglare is used forhurt eye,267
209,moon,,glare, The moon glared back at itself from the lake 's surface .,2,1,moon desiresshinemoon is capable ofrise in skymoon has propertyroundmoon is at locationskymoon is used forenergymoon is made ofrockglare desiresbe readglare is capable ofanger animalglare has propertydangerousglare is at locationpersonglare is used forhurt eye,262
210,sun,,glare, The sun glared down on us .,2,1,sun desiresshinesun is capable ofshine brightsun has propertybrightsun is at locationskysun is used forenergysun is made ofsandglare desiresbe readglare is capable ofanger animalglare has propertydangerousglare is at locationpersonglare is used forhurt eye,258
211,firefly,,glow, The fireflies were glowing and flying about in the garden .,3,0,firefly desiresflyfirefly is capable offlyfirefly has propertyflyfirefly is at locationwebfirefly is used forflyfirefly is made ofinsectglow desiresilluminateglow is capable ofburn skinglow has propertybrightglow is at locationcasinoglow is used forilluminate,262
212,face,,glow, Her face glowed when she came out of the sauna .,2,1,face desiresbe touchface is capable ofbe different colorface has propertyroundface is at locationfaceface is used forlook at thingface is made ofboneglow desiresilluminateglow is capable ofburn skinglow has propertybrightglow is at locationcasinoglow is used forilluminate,274
213,coal,,glow, The coals were glowing in the dark .,3,0,coal desiresfuelcoal is capable ofheat earthcoal has propertyhotcoal is at locationcoal minecoal is used forcookcoal is made ofironglow desiresilluminateglow is capable ofburn skinglow has propertybrightglow is at locationcasinoglow is used forilluminate,257
214,heart,,glow, Make the people 's hearts glow .,5,1,heart desiresbe loveheart is capable ofbeatheart has propertystrongheart is at locationpersonheart is used forloveheart is made ofcellglow desiresilluminateglow is capable ofburn skinglow has propertybrightglow is at locationcasinoglow is used forilluminate,262
215,passenger,,grab, The passenger grabbed for the oxygen mask .,2,0,passenger desiresflypassenger is capable ofboard shippassenger has propertydrivepassenger is at locationbus stoppassenger is used fordrivepassenger is made ofleathergrab desireshave sexgrab is capable ofhold thinggrab has propertyfungrab is at locationfridgegrab is used forhold on to something,296
216,hand,,grab, She grabbed the child 's hand and ran out of the room .,1,0,hand desiresplay gamehand is capable ofhold thinghand has propertyhold up by wristhand is at locationpursehand is used forhold thinghand is made ofbonegrab desireshave sexgrab is capable ofhold thinggrab has propertyfungrab is at locationfridgegrab is used forhold on to something,281
