,arg1,arg2,verb,sentence,verb_idx,label,new_sentences,new_ind
289,car,,lend, I will lend you my car .,2,0,car desiresrun on gasolinecar is capable ofbe dangerouscar has propertydangerouscar is at locationin garagecar is used fortravelcar is made ofmetallend desiresget moneylend is capable ofcover debtlend has propertygoodlend is at locationbanklend is used forbuy thing,267
290,story,,lend, This story would lend itself well to serialization on television .,3,1,story desiresbe readstory is capable ofbe readstory has propertyinaccuratestory is at locationnewspaperstory is used forentertainmentstory is made offactlend desiresget moneylend is capable ofcover debtlend has propertygoodlend is at locationbanklend is used forbuy thing,274
291,criticism,,level, level criticism or charges at somebody .,0,1,criticism desiresgood relationshipcriticism is capable ofanger personcriticism has propertybadcriticism is at locationschoolcriticism is used formake person angrycriticism is made ofcriticismlevel desireswinlevel is capable ofbe different sizelevel has propertyhighlevel is at locationdesklevel is used formeasure weight,320
292,building,,level, The building was levelled .,3,0,building desiresbe buildbuilding is capable ofbe buildbuilding has propertytallbuilding is at locationbuildbuilding is used forshelterbuilding is made ofbricklevel desireswinlevel is capable ofbe different sizelevel has propertyhighlevel is at locationdesklevel is used formeasure weight,290
293,ground,,level, The ground levelled off .,2,0,ground desiresbe extinguishground is capable ofbe riseground has propertyflatground is at locationgrindground is used forstand onground is made ofsandlevel desireswinlevel is capable ofbe different sizelevel has propertyhighlevel is at locationdesklevel is used formeasure weight,281
294,fate,,lie, The fate of Bosnia lies in the hands of the West .,4,1,fate desireswinfate is capable ofhappenfate has propertyinevitablefate is at locationuniversefate is used forend lifefate is made ofconsequencelie desireswinlie is capable ofbe falselie has propertybadlie is at locationtabloid newspaperlie is used fordeception,264
295,conversation,,lighten, the conversation lightened me up a bit .,2,1,conversation desiresbe understandconversation is capable ofbe confuseconversation has propertyimportant to personconversation is at locationdinnerconversation is used forcommunicateconversation is made ofinformationlighten desireslightlighten is capable ofcause damagelighten has propertyscarylighten is at locationboatlighten is used forlighten mood,352
296,load,,lighten, she lightened the load on the tired donkey .,1,0,load desirestravelload is capable ofbe loadload has propertyheavyload is at locationgarageload is used forcarryload is made ofmetallighten desireslightlighten is capable ofcause damagelighten has propertyscarylighten is at locationboatlighten is used forlighten mood,267
297,room,,lighten, The room lightened up .,2,0,room desiresbe cleanroom is capable ofbe cleanroom has propertydarkroom is at locationhouseroom is used forsleeproom is made ofbricklighten desireslightlighten is capable ofcause damagelighten has propertyscarylighten is at locationboatlighten is used forlighten mood,269
298,tree,,line, trees line the riverbank .,1,1,tree desireswatertree is capable ofshade suntree has propertygreentree is at locationforesttree is used forshadetree is made ofwoodline desireswinline is capable ofbe different sizeline has propertystraightline is at locationsubwayline is used formeasure,255
299,sorrow,,line, sorrow had lined his face .,2,1,sorrow desiresbe let outsorrow is capable ofbe sorrowsorrow has propertybadsorrow is at locationfuneralsorrow is used formournsorrow is made oflossline desireswinline is capable ofbe different sizeline has propertystraightline is at locationsubwayline is used formeasure,272
300,book,,line, lined books are more enduring .,0,0,book desiresbe readbook is capable ofbe readbook has propertyheavybook is at locationlibrarybook is used forlearnbook is made ofpaperline desireswinline is capable ofbe different sizeline has propertystraightline is at locationsubwayline is used formeasure,256
301,truck,,load, load the truck with hay .,0,0,truck desiresracetruck is capable ofmove heavy loadtruck has propertynoisytruck is at locationgaragetruck is used fortransport thingtruck is made ofmetalload desirestravelload is capable ofbe loadload has propertyheavyload is at locationgarageload is used forcarry,264
302,gun,,load, He loaded his gun carefully .,1,0,gun desireskill persongun is capable ofbe dangerousgun has propertydangerousgun is at locationpolice stationgun is used forkill persongun is made ofmetalload desirestravelload is capable ofbe loadload has propertyheavyload is at locationgarageload is used forcarry,265
303,bag,,load, load the bags onto the trucks .,0,0,bag desiresbe carry in backpackbag is capable ofhold grocerybag has propertyheavybag is at locationgrocery storebag is used forcarry thingbag is made ofplasticload desirestravelload is capable ofbe loadload has propertyheavyload is at locationgarageload is used forcarry,270
304,bike,,lock, Lock the bike to the fence !,0,0,bike desiresracebike is capable ofmove forwardbike has propertyfunbike is at locationgaragebike is used fortravelbike is made ofmetallock desiresopenlock is capable ofkeep person outlock has propertyhard to picklock is at locationgaragelock is used forkeep person out,267
305,knee,,lock, The therapist noticed that the patient 's knees tended to lock in this exercise .,10,0,knee desiresplay tennisknee is capable ofbendknee has propertybendknee is at locationtableknee is used forstandknee is made ofleatherlock desiresopenlock is capable ofkeep person outlock has propertyhard to picklock is at locationgaragelock is used forkeep person out,277
306,hand,,lock, He locked his hands around her neck .,1,1,hand desiresplay gamehand is capable ofhold thinghand has propertyhold up by wristhand is at locationpursehand is used forhold thinghand is made ofbonelock desiresopenlock is capable ofkeep person outlock has propertyhard to picklock is at locationgaragelock is used forkeep person out,286
307,laughing,,lock, He was locked in a laughing fit .,2,1,laughing desiresbe sharelaughing is capable ofcause painlaughing has propertygoodlaughing is at locationcircuslaughing is used forfunlaughing is made offunlock desiresopenlock is capable ofkeep person outlock has propertyhard to picklock is at locationgaragelock is used forkeep person out,291
308,jewel,,lock, She locked her jewels in the safe .,1,0,jewel desiresbe give to personjewel is capable ofbe use as jewelryjewel has propertyexpensivejewel is at locationjewelry storejewel is used forplayjewel is made ofprecious stonelock desiresopenlock is capable ofkeep person outlock has propertyhard to picklock is at locationgaragelock is used forkeep person out,312
309,bicycle,,loop, The bicycle looped around the tree .,2,1,bicycle desirestravelbicycle is capable ofmove forwardbicycle has propertyfunbicycle is at locationstreet cornerbicycle is used fortravelbicycle is made ofmetalloop desiresplay gameloop is capable ofhold two object togetherloop has propertysharploop is at locationbicycleloop is used forhold thing together,308
310,plane,,loop, The stunt pilot looped his plane .,3,0,plane desiresflyplane is capable oflandplane has propertyflyplane is at locationairportplane is used forflyplane is made ofsteelloop desiresplay gameloop is capable ofhold two object togetherloop has propertysharploop is at locationbicycleloop is used forhold thing together,277
311,surface,,map, map the surface of Venus .,0,0,surface desiresswimsurface is capable ofbe different shapesurface has propertyflatsurface is at locationoceansurface is used forhold thing togethersurface is made ofsandmap desiresmapmap is capable ofshow where we bemap has propertyinaccuratemap is at locationlibrarymap is used forfind place,292
312,galaxy,,map, We have n't even begun to map the many galaxies that we know exist .,6,0,galaxy desiresexploregalaxy is capable ofspiralgalaxy has propertylargegalaxy is at locationspacegalaxy is used forlive ingalaxy is made ofatommap desiresmapmap is capable ofshow where we bemap has propertyinaccuratemap is at locationlibrarymap is used forfind place,272
313,sorrow,,map, sorrow was mapped on the mother 's face .,2,1,sorrow desiresbe let outsorrow is capable ofbe sorrowsorrow has propertybadsorrow is at locationfuneralsorrow is used formournsorrow is made oflossmap desiresmapmap is capable ofshow where we bemap has propertyinaccuratemap is at locationlibrarymap is used forfind place,272
314,prisoner,,march, The Japanese marched their prisoners through Manchuria .,2,0,prisoner desireshangprisoner is capable ofbe hangprisoner has propertydangerousprisoner is at locationprisonprisoner is used forpunishmentprisoner is made ofpersonmarch desiresfight warmarch is capable ofmarchmarch has propertymarchmarch is at locationmarch haremarch is used formarch,286
315,contribution,,match, The company matched the employees ' contributions .,2,1,contribution desiresgood lifecontribution is capable ofequal valuecontribution has propertyimportantcontribution is at locationmeetcontribution is used formake decisioncontribution is made ofsummatch desireslightmatch is capable ofburn papermatch has propertyvery hotmatch is at locationmatchmatch is used forlight candle,323
316,dream,,match, This job does n't match my dreams .,4,1,dream desiresbe wake updream is capable ofcome truedream has propertyfundream is at locationyour minddream is used forfundream is made ofideamatch desireslightmatch is capable ofburn papermatch has propertyvery hotmatch is at locationmatchmatch is used forlight candle,272
317,athlete,,match, Let them match their best athletes against ours .,2,1,athlete desireswinathlete is capable ofplay basketballathlete has propertyvery competitiveathlete is at locationsoccer gameathlete is used forplay sportathlete is made ofmusclematch desireslightmatch is capable ofburn papermatch has propertyvery hotmatch is at locationmatchmatch is used forlight candle,305
318,piece,,match, The two pieces match .,3,0,piece desiresbe write on paperpiece is capable ofbe piece of wholepiece has propertyflatpiece is at locationpuzzlepiece is used formake musicpiece is made ofmetalmatch desireslightmatch is capable ofburn papermatch has propertyvery hotmatch is at locationmatchmatch is used forlight candle,292
319,experience,,mellow, Age and experience mellowed him over the years .,3,1,experience desiresbe understandexperience is capable ofbe changeexperience has propertyimportantexperience is at locationschoolexperience is used forlearnexperience is made ofexperiencemellow desiressoothemellow is capable ofmake person feel goodmellow has propertygood for youmellow is at locationrefrigeratormellow is used forrelax,336
320,apple,,mellow, These apples need to mellow a bit more .,4,0,apple desiresbe eatapple is capable ofbe many different colorapple has propertygreenapple is at locationfridgeapple is used foreatapple is made ofapplemellow desiressoothemellow is capable ofmake person feel goodmellow has propertygood for youmellow is at locationrefrigeratormellow is used forrelax,303
321,wax,,melt, The wax melted in the sun .,2,0,wax desireswaxwax is capable ofmeltwax has propertystickywax is at locationjarwax is used forcleanwax is made ofclaymelt desireseatmelt is capable ofmeltmelt has propertyhotmelt is at locationicemelt is used formake ice,221
322,ice,,melt, The sun melted the ice .,2,0,ice desirescoolice is capable ofcool waterice has propertycoldice is at locationfreezerice is used forcool thingice is made ofwatermelt desireseatmelt is capable ofmeltmelt has propertyhotmelt is at locationicemelt is used formake ice,236
323,actor,,melt, Hundreds of actors were melting into the scene .,4,1,actor desiresbe famousactor is capable ofactactor has propertygood at actactor is at locationmovieactor is used forplayactor is made ofactormelt desireseatmelt is capable ofmeltmelt has propertyhotmelt is at locationicemelt is used formake ice,247
324,resistance,,melt, her resistance melted under his charm .,2,1,resistance desireswinresistance is capable oflead to disasterresistance has propertybadresistance is at locationwarresistance is used forcontrolresistance is made offorcemelt desireseatmelt is capable ofmeltmelt has propertyhotmelt is at locationicemelt is used formake ice,275
325,furniture,,mold, The furniture molded in the old house .,2,0,furniture desiresbe cleanfurniture is capable ofbe remakefurniture has propertydecorativefurniture is at locationhousefurniture is used formake room comfortablefurniture is made ofwoodmold desireswatermold is capable ofgrowmold has propertygoodmold is at locationrefrigeratormold is used formake something,307
326,ball,,mold, She molded the rice balls carefully .,1,0,ball desiresflyball is capable ofrollball has propertyroundball is at locationtoy storeball is used forplay basketballball is made ofrubbermold desireswatermold is capable ofgrowmold has propertygoodmold is at locationrefrigeratormold is used formake something,261
327,dress,,mold, The dress molds her beautiful figure .,2,1,dress desiresbe washdress is capable ofbe dressdress has propertysexydress is at locationsuitcasedress is used fordressdress is made ofsilkmold desireswatermold is capable ofgrowmold has propertygoodmold is at locationrefrigeratormold is used formake something,262
328,aerator,,mount, They mounted the aerator on a floating .,1,0,aerator desireslift offaerator is capable oflift heavy objectaerator has propertyfastaerator is at locationairaerator is used forliftaerator is made ofsteelmount desiresride horsemount is capable ofbe ridemount has propertybigmount is at locationmountainmount is used forride horse,282
329,slide,,mount, mount slides for macroscopic analysis .,0,0,slide desiresplay gameslide is capable ofbe dangerousslide has propertyhardslide is at locationpianoslide is used forslideslide is made ofmetalmount desiresride horsemount is capable ofbe ridemount has propertybigmount is at locationmountainmount is used forride horse,268
330,campaign,,mount, mount a campaign against pornography .,0,1,campaign desireswin electioncampaign is capable ofbe counter - campaigncampaign has propertybadcampaign is at locationcitycampaign is used forget moneycampaign is made ofpoliticianmount desiresride horsemount is capable ofbe ridemount has propertybigmount is at locationmountainmount is used forride horse,305
331,production,,mount, mount a theater production .,0,1,production desiresmake moneyproduction is capable ofincrease productionproduction has propertyfunproduction is at locationtheaterproduction is used forproduceproduction is made ofpersonmount desiresride horsemount is capable ofbe ridemount has propertybigmount is at locationmountainmount is used forride horse,310
332,husband,,nag, She nags her husband all day long .,1,0,husband desiresbe marry to womanhusband is capable ofmarry wifehusband has propertymalehusband is at locationbedhusband is used forwifehusband is made ofmalenag desiresbe let outnag is capable ofbe good petnag has propertyannoynag is at locationyour dognag is used forget food,277
333,doubt,,nag, nagging concerns and doubts .,0,1,doubt desireswindoubt is capable ofbe falsedoubt has propertyfalsedoubt is at locationbibledoubt is used forliedoubt is made offactnag desiresbe let outnag is capable ofbe good petnag has propertyannoynag is at locationyour dognag is used forget food,250
334,security,,negociate, negociate securities .,0,0,security desireswinsecurity is capable ofguard prisonersecurity has propertybadsecurity is at locationairportsecurity is used forprotect personsecurity is made ofpersonnegociate desiresequalitynegociate is capable ofbe in europenegociate has propertycoldnegociate is at locationindianegociate is used forlive in,311
335,mountain,,negociate, The hiker negociated the high mountain pass .,2,1,mountain desiresclimb mountainmountain is capable ofbe very tall buildmountain has propertyvery tallmountain is at locationmountainmountain is used forclimbmountain is made ofrocknegociate desiresequalitynegociate is capable ofbe in europenegociate has propertycoldnegociate is at locationindianegociate is used forlive in,324
336,party,,negociate, The parties negociated all night .,2,0,party desiresbe celebrateparty is capable ofinclude partyparty has propertyfunparty is at locationfraternity houseparty is used forcelebrateparty is made ofpersonnegociate desiresequalitynegociate is capable ofbe in europenegociate has propertycoldnegociate is at locationindianegociate is used forlive in,307
337,republic,,neutralize, The treaty neutralized the small republic .,2,1,republic desiresfight warrepublic is capable offight warrepublic has propertycorruptrepublic is at locationchinarepublic is used forgovernrepublic is made ofideologyneutralize desireswinneutralize is capable ofkillneutralize has propertydangerousneutralize is at locationwarneutralize is used forkill,302
338,optimism,,neutralize, Her optimism neutralizes his gloom .,2,1,optimism desiresbe overcomeoptimism is capable ofbe falseoptimism has propertygoodoptimism is at locationoffice buildoptimism is used foroptimismoptimism is made ofoptimismneutralize desireswinneutralize is capable ofkillneutralize has propertydangerousneutralize is at locationwarneutralize is used forkill,309
339,solution,,neutralize, She neutralized the solution .,1,0,solution desiressolutionsolution is capable ofbe solutionsolution has propertyimportantsolution is at locationmath booksolution is used forsolve problemsolution is made ofsolutionneutralize desireswinneutralize is capable ofkillneutralize has propertydangerousneutralize is at locationwarneutralize is used forkill,315
340,approval,,nod, He nodded his approval .,1,0,approval desiresbe meetapproval is capable ofbe falseapproval has propertyimportantapproval is at locationchurchapproval is used formake decisionapproval is made ofchoicenod desiresbe understandnod is capable ofindicate agreementnod has propertynodnod is at locationrestaurantnod is used forindicate agreement,310
341,teacher,,nod, The teacher nodded when the student gave the right answer .,2,0,teacher desiresstudent to learnteacher is capable ofexplainteacher has propertyimportantteacher is at locationclassroomteacher is used forteachteacher is made ofpersonnod desiresbe understandnod is capable ofindicate agreementnod has propertynodnod is at locationrestaurantnod is used forindicate agreement,308
342,man,,nod, The old man was nodding in his chair .,4,0,man desiresbe goodman is capable ofbe goodman has propertymaleman is at locationofficeman is used forloveman is made ofmusclenod desiresbe understandnod is capable ofindicate agreementnod has propertynodnod is at locationrestaurantnod is used forindicate agreement,268
343,flower,,nod, the flowers were nodding in the breeze .,3,1,flower desiresflowerflower is capable ofwiltflower has propertyprettyflower is at locationwindowsillflower is used fordecorate roomflower is made offlowernod desiresbe understandnod is capable ofindicate agreementnod has propertynodnod is at locationrestaurantnod is used forindicate agreement,296
344,room,,paint, We painted the rooms yellow .,1,0,room desiresbe cleanroom is capable ofbe cleanroom has propertydarkroom is at locationhouseroom is used forsleeproom is made ofbrickpaint desirespaint picturepaint is capable ofbe different colorpaint has propertyfunpaint is at locationart showpaint is used formake art,270
345,mistress,,paint, He painted his mistress many times .,1,0,mistress desiresmanmistress is capable ofclean roommistress has propertygood at what she domistress is at locationmansionmistress is used forsexmistress is made ofwoodpaint desirespaint picturepaint is capable ofbe different colorpaint has propertyfunpaint is at locationart showpaint is used formake art,305
346,heart,,palpitate, Her violent feelings palpitated the young woman 's heart .,3,0,heart desiresbe loveheart is capable ofbeatheart has propertystrongheart is at locationpersonheart is used forloveheart is made ofcellpalpitate desiresvomitpalpitate is capable ofcause heart attackpalpitate has propertybadpalpitate is at locationstomachpalpitate is used forincrease heart rate,296
347,sign,,paste, paste the sign on the wall .,0,0,sign desiresbe writesign is capable ofindicate agreementsign has propertyredsign is at locationroadblocksign is used fortell you somethingsign is made ofpaperpaste desirespastepaste is capable ofbe pastepaste has propertystickypaste is at locationfridgepaste is used formake paste,280
348,wall,,paste, paste the sign on the wall .,0,0,wall desiresbe openwall is capable ofseparate roomwall has propertyverticalwall is at locationwallwall is used fordivide roomwall is made ofconcretepaste desirespastepaste is capable ofbe pastepaste has propertystickypaste is at locationfridgepaste is used formake paste,270
349,opponent,,paste, He pasted his opponent .,1,1,opponent desireswinopponent is capable offightopponent has propertycompetitiveopponent is at locationsport eventopponent is used forwinopponent is made ofpersonpaste desirespastepaste is capable ofbe pastepaste has propertystickypaste is at locationfridgepaste is used formake paste,283
350,moon,,peep, The new moon peeped through the tree tops .,3,1,moon desiresshinemoon is capable ofrise in skymoon has propertyroundmoon is at locationskymoon is used forenergymoon is made ofrockpeep desiresflypeep is capable ofhearpeep has propertysmallpeep is at locationchurchpeep is used forlet in light,246
351,cold,,pierce, The cold pierced her bones .,2,1,cold desiresbe extinguishcold is capable ofkill youcold has propertyhard to ski oncold is at locationfreezercold is used forkill bacteriacold is made ofwaterpierce desiresget laypierce is capable ofpierce your fingerpierce has propertysharppierce is at locationyour fingerpierce is used forkill animal,303
352,scream,,pierce, The scream pierced the night .,2,1,scream desiresbe let outscream is capable ofmake person cryscream has propertybadscream is at locationoperascream is used forget helpscream is made ofpainpierce desiresget laypierce is capable ofpierce your fingerpierce has propertysharppierce is at locationyour fingerpierce is used forkill animal,300
353,needle,,pierce, The needle pierced her flesh .,2,0,needle desiressewneedle is capable ofpierce skinneedle has propertysharpneedle is at locationsew kitneedle is used forinject bloodneedle is made ofsteelpierce desiresget laypierce is capable ofpierce your fingerpierce has propertysharppierce is at locationyour fingerpierce is used forkill animal,298
354,needle,,pin, pin the needle to the shirt .,0,0,needle desiressewneedle is capable ofpierce skinneedle has propertysharpneedle is at locationsew kitneedle is used forinject bloodneedle is made ofsteelpin desiresplay gamepin is capable ofpierce skinpin has propertysharppin is at locationdeskpin is used forhold thing together,277
355,bug,,ping, The bugs pinged the lamp shade .,2,0,bug desireseatbug is capable offlybug has propertysmallbug is at locationtreebug is used foreatbug is made ofcellping desiresplay gameping is capable ofbe toyping has propertyfunping is at locationtoy storeping is used forplay ping pong,238
356,bullet,,ping, the bullet pinged when they struck the car .,2,0,bullet desireskillbullet is capable ofbe fatalbullet has propertydangerousbullet is at locationgunbullet is used forkillbullet is made ofmetalping desiresplay gameping is capable ofbe toyping has propertyfunping is at locationtoy storeping is used forplay ping pong,267
357,accountant,,ping, I 'll ping my accountant -- April 15 is nearing .,2,1,accountant desiresmoneyaccountant is capable ofmake moneyaccountant has propertyvery importantaccountant is at locationofficeaccountant is used formanage companyaccountant is made ofaccountantping desiresplay gameping is capable ofbe toyping has propertyfunping is at locationtoy storeping is used forplay ping pong,317
358,machine,,ping, ping your machine in the office .,0,0,machine desireseatmachine is capable ofdispensemachine has propertymechanicalmachine is at locationlaboratorymachine is used formake popcornmachine is made ofmetalping desiresplay gameping is capable ofbe toyping has propertyfunping is at locationtoy storeping is used forplay ping pong,286
359,market,,plunge, the stock market plunged .,3,1,market desiresgood productmarket is capable ofsell productmarket has propertyvery popularmarket is at locationcitymarket is used forbuy thingmarket is made ofpersonplunge desiresswimplunge is capable ofkill youplunge has propertydangerousplunge is at locationriverplunge is used forkill yourself,298
360,student,,plunge, The professor plunged his students into the study of the Italian text .,2,1,student desiresstudystudent is capable oflearnstudent has propertysmartstudent is at locationclassroomstudent is used forlearnstudent is made ofpersonplunge desiresswimplunge is capable ofkill youplunge has propertydangerousplunge is at locationriverplunge is used forkill yourself,283
361,mind,,poison, poison someone 's mind .,0,1,mind desiresbe freemind is capable ofbe dangerousmind has propertygoodmind is at locationyour headmind is used forthinkmind is made ofthoughtpoison desireskillpoison is capable ofkillpoison has propertyfatalpoison is at locationlaboratorypoison is used forkill,260
362,husband,,poison, She poisoned her husband .,1,0,husband desiresbe marry to womanhusband is capable ofmarry wifehusband has propertymalehusband is at locationbedhusband is used forwifehusband is made ofmalepoison desireskillpoison is capable ofkillpoison has propertyfatalpoison is at locationlaboratorypoison is used forkill,277
