,arg1,arg2,verb,sentence,verb_idx,label,new_sentences,new_ind
435,soprano,,rotate, We rotate the lead soprano every night .,1,1,soprano desiressingsoprano is capable ofsing ariasoprano has propertysingsoprano is at locationchoirsoprano is used forsingsoprano is made ofstring quartetrotate desiresbe userotate is capable ofrotaterotate has propertyhardrotate is at locationmusic storerotate is used forrotate,281
436,intern,,rotate, Interns have to rotate for a few months .,3,1,intern desiresjobintern is capable ofwork in officeintern has propertyboreintern is at locationofficeintern is used forworkintern is made ofpersonrotate desiresbe userotate is capable ofrotaterotate has propertyhardrotate is at locationmusic storerotate is used forrotate,274
437,crop,,rotate, We rotate the crops so as to maximize the use of the soil .,1,1,crop desiresgrowcrop is capable ofgrow in droughtcrop has propertygreencrop is at locationfieldcrop is used forgrow foodcrop is made ofcornrotate desiresbe userotate is capable ofrotaterotate has propertyhardrotate is at locationmusic storerotate is used forrotate,265
438,composure,,ruffle, She wanted to ruffle his composure .,3,1,composure desirescalmcomposure is capable offool personcomposure has propertybadcomposure is at locationdinnercomposure is used forcontrol angercomposure is made ofemotionruffle desiresyour hairruffle is capable offlyruffle has propertysoftruffle is at locationskirtruffle is used forkeep your hair out of eye,312
439,people,,ruffle, This play is going to ruffle some people .,5,1,people desiresbe freepeople is capable ofeatpeople has propertyselfishpeople is at locationbus stoppeople is used forworkpeople is made ofpersonruffle desiresyour hairruffle is capable offlyruffle has propertysoftruffle is at locationskirtruffle is used forkeep your hair out of eye,287
440,feather,,ruffle, The bird ruffled its feathers .,2,0,feather desiresflyfeather is capable offlyfeather has propertysoftfeather is at locationbird nestfeather is used fordecorationfeather is made offeatherruffle desiresyour hairruffle is capable offlyruffle has propertysoftruffle is at locationskirtruffle is used forkeep your hair out of eye,291
441,surface,,ruffle, The wind ruffled the surface of the water .,2,0,surface desiresswimsurface is capable ofbe different shapesurface has propertyflatsurface is at locationoceansurface is used forhold thing togethersurface is made ofsandruffle desiresyour hairruffle is capable offlyruffle has propertysoftruffle is at locationskirtruffle is used forkeep your hair out of eye,309
442,fabric,,ruffle, The seamstress ruffled the curtain fabric .,2,0,fabric desiresbe cleanfabric is capable ofbe fabricfabric has propertyweavefabric is at locationsew roomfabric is used formake curtainfabric is made offabricruffle desiresyour hairruffle is capable offlyruffle has propertysoftruffle is at locationskirtruffle is used forkeep your hair out of eye,297
443,car,,ruin, You have ruined my car by pouring sugar in the tank !,2,0,car desiresrun on gasolinecar is capable ofbe dangerouscar has propertydangerouscar is at locationin garagecar is used fortravelcar is made ofmetalruin desireswinruin is capable ofdestroy goodruin has propertygoodruin is at locationforestruin is used forrecycle,263
444,chance,,ruin, This behavior will ruin your chances of winning the election .,3,1,chance desiresbe freechance is capable ofbe falsechance has propertyunpredictablechance is at locationfuturechance is used forwinchance is made oftimeruin desireswinruin is capable ofdestroy goodruin has propertygoodruin is at locationforestruin is used forrecycle,267
445,field,,salt, the rebels had salted the fields with mines and traps .,3,1,field desireswinfield is capable ofbe greenfield has propertygreenfield is at locationcountrysidefield is used forgrow foodfield is made ofgrasssalt desiressaltsalt is capable ofmelt icesalt has propertywhitesalt is at locationoceansalt is used forflavor food,262
446,lecture,,salt, She salts her lectures with jokes .,1,1,lecture desiresstudent to studylecture is capable ofteachlecture has propertyborelecture is at locationschoollecture is used forlearnlecture is made ofpersonsalt desiressaltsalt is capable ofmelt icesalt has propertywhitesalt is at locationoceansalt is used forflavor food,273
447,meat,,salt, people used to salt meats on ships .,3,0,meat desiresmeatmeat is capable ofbe cookmeat has propertygoodmeat is at locationrefrigeratormeat is used forcookmeat is made ofmeatsalt desiressaltsalt is capable ofmelt icesalt has propertywhitesalt is at locationoceansalt is used forflavor food,250
448,courage,,salute, I salute your courage !,1,1,courage desiresbe forgivecourage is capable ofbe falsecourage has propertyimportantcourage is at locationchurchcourage is used forfight injusticecourage is made ofcouragesalute desiresperson to salutesalute is capable ofsalutesalute has propertyimportantsalute is at locationpost officesalute is used forhonor,310
449,stench,,salute, a terrible stench saluted our nostrils .,3,1,stench desiresrotstench is capable ofdecaystench has propertyunpleasantstench is at locationsewerstench is used forkillstench is made ofskunksalute desiresperson to salutesalute is capable ofsalutesalute has propertyimportantsalute is at locationpost officesalute is used forhonor,283
450,soldier,,salute," When the officers show up , the soldiers have to salute .",10,0,soldier desiresfightsoldier is capable offightsoldier has propertydangeroussoldier is at locationmilitary basesoldier is used forfightsoldier is made ofsoldiersalute desiresperson to salutesalute is capable ofsalutesalute has propertyimportantsalute is at locationpost officesalute is used forhonor,308
451,X-ray,,scan, the surgeon scanned the X - ray .,2,0,X-ray desiresburnX-ray is capable ofhurtX-ray has propertyharmful to eyeX-ray is at locationairportX-ray is used forsee inside personX-ray is made ofelectronscan desireswinscan is capable offind errorscan has propertyuseful for learnscan is at locationcomputerscan is used forfind something out,296
452,headline,,scan, She scanned the newspaper headlines while waiting for the taxi .,1,1,headline desiresbe readheadline is capable ofread headlineheadline has propertyread by personheadline is at locationnewspaperheadline is used forreadheadline is made ofnewspaperscan desireswinscan is capable offind errorscan has propertyuseful for learnscan is at locationcomputerscan is used forfind something out,315
453,sky,,scan, The beams scanned the night sky .,2,1,sky desiresflysky is capable ofbe different colorsky has propertyblack at nightsky is at locationskysky is used forflysky is made ofcloudscan desireswinscan is capable offind errorscan has propertyuseful for learnscan is at locationcomputerscan is used forfind something out,276
454,heat,,scorch, The heat scorched the countryside .,2,1,heat desiresfuelheat is capable ofburn skinheat has propertyhotheat is at locationovenheat is used forcookheat is made ofenergyscorch desireseat human fleshscorch is capable ofcause skin to splitscorch has propertyhotscorch is at locationfirescorch is used forcook,266
455,forest,,scorch, The wildfire scorched the forest and several homes .,2,0,forest desireswaterforest is capable ofbe beautiful place to liveforest has propertygreenforest is at locationcountrysideforest is used forshelterforest is made oftreescorch desireseat human fleshscorch is capable ofcause skin to splitscorch has propertyhotscorch is at locationfirescorch is used forcook,306
456,cat,,scrape, The cat scraped at the armchair .,2,0,cat desireseatcat is capable ofsleep in bedcat has propertycurious about flowercat is at locationyour lapcat is used forpetcat is made ofwoodscrape desiresscratchscrape is capable ofscratchscrape has propertysharpscrape is at locationtablescrape is used forremove dirt,270
457,letter,,scrape, They scraped a letter into the stone .,1,0,letter desiresbe writeletter is capable ofbe readletter has propertywrite on paperletter is at locationmail boxletter is used forcommunicationletter is made ofpaperscrape desiresscratchscrape is capable ofscratchscrape has propertysharpscrape is at locationtablescrape is used forremove dirt,292
458,money,,scrape, She had scraped together enough money for college .,2,1,money desiresbe sharemoney is capable ofbuy happinessmoney has propertygoodmoney is at locationbankmoney is used forbuy thingmoney is made ofmoneyscrape desiresscratchscrape is capable ofscratchscrape has propertysharpscrape is at locationtablescrape is used forremove dirt,275
459,money,,seize, The sales clerk quickly seized the money on the counter .,4,0,money desiresbe sharemoney is capable ofbuy happinessmoney has propertygoodmoney is at locationbankmoney is used forbuy thingmoney is made ofmoneyseize desireswinseize is capable ofbe dangerousseize has propertydangerousseize is at locationdeskseize is used forhurt someone,277
460,invader,,seize, the invaders seized the land and property of the inhabitants .,2,0,invader desiresconquer worldinvader is capable ofinvadeinvader has propertyevilinvader is at locationwarinvader is used forinvadeinvader is made ofmammalseize desireswinseize is capable ofbe dangerousseize has propertydangerousseize is at locationdeskseize is used forhurt someone,282
461,fear,,seize, Fear seized the prisoners .,1,1,fear desiresbe freefear is capable ofmake you sickfear has propertybadfear is at locationwarfear is used forfearfear is made offearseize desireswinseize is capable ofbe dangerousseize has propertydangerousseize is at locationdeskseize is used forhurt someone,259
462,book,,sell, These books sell like hot cakes .,2,0,book desiresbe readbook is capable ofbe readbook has propertyheavybook is at locationlibrarybook is used forlearnbook is made ofpapersell desiressell productsell is capable ofbuy housesell has propertybadsell is at locationmarketsell is used forbuy thing,256
463,image,,sell, The French try to sell us their image as great lovers .,4,1,image desiresbe createimage is capable ofbe reverseimage has propertyreflectiveimage is at locationmovieimage is used fordescribe thingimage is made ofpapersell desiressell productsell is capable ofbuy housesell has propertybadsell is at locationmarketsell is used forbuy thing,281
464,shoe,,sell, The brothers sell shoes .,2,0,shoe desiresbe cleanshoe is capable ofbe wearshoe has propertyuglyshoe is at locationclosetshoe is used forprotect foot from injuryshoe is made ofleathersell desiressell productsell is capable ofbuy housesell has propertybadsell is at locationmarketsell is used forbuy thing,276
465,hope,,shake, The bad news shook her hopes .,3,1,hope desiresbe truehope is capable ofbe false hopehope has propertytruehope is at locationdreamhope is used forhopehope is made ofbeliefshake desiresdrinkshake is capable ofmake person sneezeshake has propertyfunshake is at locationrestaurantshake is used forgreet person,274
466,salt,,shake, Shake the salt out of the salt shaker .,0,0,salt desiressaltsalt is capable ofmelt icesalt has propertywhitesalt is at locationoceansalt is used forflavor foodsalt is made ofsugarshake desiresdrinkshake is capable ofmake person sneezeshake has propertyfunshake is at locationrestaurantshake is used forgreet person,270
467,argument,,sharpen, We had to sharpen our arguments .,3,1,argument desiresargumentargument is capable ofbe debateargument has propertybadargument is at locationargumentargument is used forargumentargument is made ofargumentsharpen desireswritesharpen is capable ofhurtsharpen has propertysharpsharpen is at locationdesksharpen is used forsharpen,290
468,debate,,sharpen, The debate sharpened .,2,1,debate desiresdebatedebate is capable ofbe debatedebate has propertyimportantdebate is at locationdebatedebate is used fordebatedebate is made ofopinionsharpen desireswritesharpen is capable ofhurtsharpen has propertysharpsharpen is at locationdesksharpen is used forsharpen,276
469,vision,,sharpen, This drug will sharpen your vision .,3,1,vision desiresbe changevision is capable ofbe deceivevision has propertyvery importantvision is at locationbookvision is used forseevision is made ofsoundsharpen desireswritesharpen is capable ofhurtsharpen has propertysharpsharpen is at locationdesksharpen is used forsharpen,279
470,image,,shed, He shed his image as a pushy boss .,1,1,image desiresbe createimage is capable ofbe reverseimage has propertyreflectiveimage is at locationmovieimage is used fordescribe thingimage is made ofpapershed desiresclean airshed is capable ofstore watershed has propertygreenshed is at locationbackyardshed is used forstore tool,282
471,tear,,shed, She shed a lot of tears when this happened .,1,0,tear desiresbe holdtear is capable ofbe uglytear has propertymessytear is at locationyour eyetear is used forcrytear is made oftearshed desiresclean airshed is capable ofstore watershed has propertygreenshed is at locationbackyardshed is used forstore tool,257
472,dog,,shed, Our dog sheds every Spring .,2,0,dog desiresplay with balldog is capable ofbe good frienddog has propertyloyaldog is at locationyour housedog is used forprotect persondog is made ofwoodshed desiresclean airshed is capable ofstore watershed has propertygreenshed is at locationbackyardshed is used forstore tool,279
473,career,,shipwreck, You have shipwrecked my career .,2,1,career desireswincareer is capable ofend in tragedycareer has propertyimportantcareer is at locationuniversitycareer is used forget jobcareer is made ofworkshipwreck desireslifeshipwreck is capable ofbe disastershipwreck has propertysadshipwreck is at locationseashipwreck is used forship,290
474,vessel,,shipwreck, The vessel was shipwrecked .,3,0,vessel desirestravelvessel is capable ofsinkvessel has propertybigvessel is at locationoceanvessel is used forshipvessel is made ofsteelshipwreck desireslifeshipwreck is capable ofbe disastershipwreck has propertysadshipwreck is at locationseashipwreck is used forship,271
475,praise,,shower, He was showered with praise .,2,1,praise desiresbe believepraise is capable ofmake person feel goodpraise has propertygoodpraise is at locationchurchpraise is used formake person feel goodpraise is made ofemotionshower desiresbe cleanshower is capable ofwash offshower has propertyfunshower is at locationbathroomshower is used forwash,303
476,meteor,,shower, Meteors showered down over half of Australia .,1,0,meteor desirestravelmeteor is capable oftravel in orbitmeteor has propertyvery largemeteor is at locationspacemeteor is used fortravel between solar systemmeteor is made ofrockshower desiresbe cleanshower is capable ofwash offshower has propertyfunshower is at locationbathroomshower is used forwash,300
477,present,,shower, He showered her with presents .,1,1,present desiresbe fulfilpresent is capable ofsurprise childpresent has propertyfunpresent is at locationboxpresent is used forgive to someonepresent is made ofpapershower desiresbe cleanshower is capable ofwash offshower has propertyfunshower is at locationbathroomshower is used forwash,288
478,soldier,,sift, The soldiers sifted through the woods .,2,1,soldier desiresfightsoldier is capable offightsoldier has propertydangeroussoldier is at locationmilitary basesoldier is used forfightsoldier is made ofsoldiersift desiresopen bottle of winesift is capable ofpile up pilesift has propertymessysift is at locationtablesift is used forremove dirt,295
479,information,,sift, He sifted the information .,1,1,information desiresbe freeinformation is capable ofbe distortinformation has propertyusefulinformation is at locationnewspaperinformation is used forlearninformation is made ofinformationsift desiresopen bottle of winesift is capable ofpile up pilesift has propertymessysift is at locationtablesift is used forremove dirt,322
480,candidate,,sift, They sifted through the job candidates .,1,1,candidate desiresbe electcandidate is capable ofbe electcandidate has propertyelectcandidate is at locationconferencecandidate is used forelectcandidate is made ofpersonsift desiresopen bottle of winesift is capable ofpile up pilesift has propertymessysift is at locationtablesift is used forremove dirt,304
481,nightingale,,sing, The nightingale was singing .,3,0,nightingale desiresplay harpnightingale is capable ofsingnightingale has propertyvery smartnightingale is at locationzoonightingale is used forsingnightingale is made ofwoodsing desiresmake musicsing is capable ofmake person happysing has propertyfunsing is at locationoperasing is used forentertainment,306
482,kettle,,sing, the kettle was singing .,3,1,kettle desiresboil waterkettle is capable ofboil waterkettle has propertyhotkettle is at locationstovekettle is used forboil waterkettle is made ofwatersing desiresmake musicsing is capable ofmake person happysing has propertyfunsing is at locationoperasing is used forentertainment,285
483,court,,sit, When does the court of law sit ?,6,1,court desiresjusticecourt is capable ofobject to court casecourt has propertyimportantcourt is at locationcitycourt is used forjudgecourt is made ofpersonsit desiresbe entertainsit is capable ofbe fun activitysit has propertyrelaxsit is at locationtablesit is used forrelaxation,284
484,house,,sit, The White House sits on Pennsylvania Avenue .,3,1,house desiresbe cleanhouse is capable ofbe buildhouse has propertybuildhouse is at locationtownhouse is used forlive inhouse is made ofbricksit desiresbe entertainsit is capable ofbe fun activitysit has propertyrelaxsit is at locationtablesit is used forrelaxation,267
485,car,,smash, She smashed her car against the guard rail .,1,0,car desiresrun on gasolinecar is capable ofbe dangerouscar has propertydangerouscar is at locationin garagecar is used fortravelcar is made ofmetalsmash desireswinsmash is capable ofhurtsmash has propertyloudsmash is at locationwallsmash is used formake music,260
486,motorcycle,,smash, The motorcycle smashed into the guard rail .,2,0,motorcycle desiresracemotorcycle is capable ofmove fastmotorcycle has propertyfunmotorcycle is at locationgaragemotorcycle is used fortravelmotorcycle is made ofmetalsmash desireswinsmash is capable ofhurtsmash has propertyloudsmash is at locationwallsmash is used formake music,280
487,ring,,smash, The police smashed the drug ring after they were tipped off .,2,1,ring desiresbe playring is capable ofbe wearring has propertyroundring is at locationringring is used fordecorationring is made ofgoldsmash desireswinsmash is capable ofhurtsmash has propertyloudsmash is at locationwallsmash is used formake music,248
488,meat,,smother, smother the meat in gravy .,0,0,meat desiresmeatmeat is capable ofbe cookmeat has propertygoodmeat is at locationrefrigeratormeat is used forcookmeat is made ofmeatsmother desiresbe freesmother is capable ofbe smothersmother has propertyfunnysmother is at locationbedsmother is used forsuffocate,263
489,cream,,smother, the butter cream smothered the cake .,3,1,cream desirescreamcream is capable ofcoat your fingercream has propertysweetcream is at locationfridgecream is used formake creamcream is made ofsugarsmother desiresbe freesmother is capable ofbe smothersmother has propertyfunnysmother is at locationbedsmother is used forsuffocate,284
490,disapproval,,snort, she snorted her disapproval of the proposed bridegroom .,1,1,disapproval desiresbe let outdisapproval is capable ofanger persondisapproval has propertybaddisapproval is at locationchurchdisapproval is used formake someone feel baddisapproval is made ofangersnort desiressnortsnort is capable oflaughtersnort has propertyfunnysnort is at locationcomedy routinesnort is used formake joke,325
491,critic,,snort, The critic snorted contemptuously .,2,1,critic desiresgood jobcritic is capable ofpaint picturecritic has propertygoodcritic is at locationshowcritic is used forportray somethingcritic is made ofpersonsnort desiressnortsnort is capable oflaughtersnort has propertyfunnysnort is at locationcomedy routinesnort is used formake joke,291
492,cocaine,,snort, The addict was snorting cocaine almost every day .,3,0,cocaine desirescocainecocaine is capable ofcloud skycocaine has propertyillegalcocaine is at locationdrug storecocaine is used forpleasurecocaine is made ofcocainesnort desiressnortsnort is capable oflaughtersnort has propertyfunnysnort is at locationcomedy routinesnort is used formake joke,294
493,seed,,sow, She sowed sunflower seeds .,1,0,seed desiresseedseed is capable ofgrowseed has propertygreenseed is at locationseed podseed is used forseedseed is made ofseedsow desiresflowersow is capable ofmilk goatsow has propertyfemalesow is at locationfieldsow is used forproduce milk,242
494,suspicion,,sow, sow suspicion or beliefs .,0,1,suspicion desiresfind truthsuspicion is capable ofcloud judgementsuspicion has propertyfalsesuspicion is at locationchurchsuspicion is used forliesuspicion is made offactsow desiresflowersow is capable ofmilk goatsow has propertyfemalesow is at locationfieldsow is used forproduce milk,285
495,ground,,sow, sow the ground with sunflower seeds .,0,0,ground desiresbe extinguishground is capable ofbe riseground has propertyflatground is at locationgrindground is used forstand onground is made ofsandsow desiresflowersow is capable ofmilk goatsow has propertyfemalesow is at locationfieldsow is used forproduce milk,265
496,word,,spell, How do you spell this word ?,3,0,word desiresbe writeword is capable ofmean somethingword has propertybadword is at locationsentenceword is used forinsultword is made ofsoundspell desirescreatespell is capable ofbe castspell has propertyfunspell is at locationspell bookspell is used formake spell,267
497,trouble,,spell, I 'm afraid this spells trouble !,4,1,trouble desireswintrouble is capable ofbe bad thingtrouble has propertybadtrouble is at locationjailtrouble is used forget jobtrouble is made ofconsequencespell desirescreatespell is capable ofbe castspell has propertyfunspell is at locationspell bookspell is used formake spell,282
498,husband,,spell, She spelled her husband at the wheel .,1,1,husband desiresbe marry to womanhusband is capable ofmarry wifehusband has propertymalehusband is at locationbedhusband is used forwifehusband is made ofmalespell desirescreatespell is capable ofbe castspell has propertyfunspell is at locationspell bookspell is used formake spell,281
499,worker,,spell, the workers spell every four hours .,2,1,worker desiresworkworker is capable ofworkworker has propertylazyworker is at locationworkworker is used forworkworker is made ofworkerspell desirescreatespell is capable ofbe castspell has propertyfunspell is at locationspell bookspell is used formake spell,260
500,water,,splash, She splashed the water around her .,1,0,water desiresdrinkwater is capable offlow downhillwater has propertynecessary for lifewater is at locationice cubewater is used forwashwater is made ofwatersplash desiresswim in oceansplash is capable ofbe spraysplash has propertyfunsplash is at locationwaterfallsplash is used forswim,286
501,water,,splash, She splashed the water around her .,1,0,water desiresdrinkwater is capable offlow downhillwater has propertynecessary for lifewater is at locationice cubewater is used forwashwater is made ofwatersplash desiresswim in oceansplash is capable ofbe spraysplash has propertyfunsplash is at locationwaterfallsplash is used forswim,286
502,mountain,,splash, The mountain was splashed with snow .,3,1,mountain desiresclimb mountainmountain is capable ofbe very tall buildmountain has propertyvery tallmountain is at locationmountainmountain is used forclimbmountain is made ofrocksplash desiresswim in oceansplash is capable ofbe spraysplash has propertyfunsplash is at locationwaterfallsplash is used forswim,311
503,tablecloth,,spot, The wine spotted the tablecloth .,2,0,tablecloth desirescover tabletablecloth is capable ofcover tabletablecloth has propertywhitetablecloth is at locationtabletablecloth is used forcover tabletablecloth is made ofsilkspot desiresplayspot is capable ofcut youspot has propertyflatspot is at locationmapspot is used forhold thing together,301
504,dress,,spot, This dress spots quickly .,2,0,dress desiresbe washdress is capable ofbe dressdress has propertysexydress is at locationsuitcasedress is used fordressdress is made ofsilkspot desiresplayspot is capable ofcut youspot has propertyflatspot is at locationmapspot is used forhold thing together,260
505,area,,spot, spot the areas that one should clearly identify .,0,0,area desiresbe freearea is capable ofbe different sizearea has propertyflatarea is at locationcityarea is used forstore thingarea is made ofconcretespot desiresplayspot is capable ofcut youspot has propertyflatspot is at locationmapspot is used forhold thing together,267
506,water,,spray, Water sprayed all over the floor .,1,0,water desiresdrinkwater is capable offlow downhillwater has propertynecessary for lifewater is at locationice cubewater is used forwashwater is made ofwaterspray desiressprayspray is capable ofsprayspray has propertycoolspray is at locationwaterfallspray is used forspray,272
507,water,,spray, spray water on someone .,0,0,water desiresdrinkwater is capable offlow downhillwater has propertynecessary for lifewater is at locationice cubewater is used forwashwater is made ofwaterspray desiressprayspray is capable ofsprayspray has propertycoolspray is at locationwaterfallspray is used forspray,271
508,wall,,spray, spray the wall with paint .,0,0,wall desiresbe openwall is capable ofseparate roomwall has propertyverticalwall is at locationwallwall is used fordivide roomwall is made ofconcretespray desiressprayspray is capable ofsprayspray has propertycoolspray is at locationwaterfallspray is used forspray,263
